345,7548,18297,ESC. BÁS. N° 4818 TAJY POTY ,,AREGUÁ,CAACUPEMI,URBANA,ASENT. TAJY POTY,R3,147,N1,MURALLA,,OTRO,ANDE,PRIVADO,SI,DEBIDO A QUE ESTAMOS RODEADOS DE VARIAS VILLAS Y NO RESPETAN LA PROPIEDAD DE LA INSTITUCION INGRESANDO EN EL PREDIO CAUSANDO PERJUICIOS,CENTRAL,11
341,7556,18298,ESC. BÁS. N° 4646 VIRGEN DE CAACUPÉ ,,AREGUÁ,VILLA SOLIDARIDAD,URBANA,,R3,106,N1,MURALLA CON  PORTONES DE HIERRO,,ESSAP/SENASA,ANDE,MUNICIPAL EN GESTION DE TRANFERENCIA AL MEC,SI,"DEFICIT, INSEGURIDAD EN LA ZONA",CENTRAL,11
189,1110043,18456,"EEB: 6566 ""12 DE JUNIO""",,M.R. A.,MONSEÑOR BOGARIN,URBANA,,R9,90,N1,AULAS,5,ESSAP/SENASA,ANDE,EN GESTIÓN,SI,NECESITAMOS LA CONSTRUCCION DE UN PABELLON EXCLUSIVO PARA EL TERCER CICLO Y MEDIA,CENTRAL,11
195,1110043,18456,"EEB: 6566 ""12 DE JUNIO""",,M.R. A.,MONSEÑOR BOGARIN,URBANA,,R9,,N1,DIRECCIÓN,1,ESSAP/SENASA,ANDE,EN GESTIÓN,SI,"EN EL ESPACIO DESTINADO PARA DIRECCION FUNCIONA: VICE DIRECCION, SECRETARIA, COORDINACION, BIBLIOTECA, DEPOSITO Y OTROS.",CENTRAL,11
201,1110043,18456,"EEB: 6566 ""12 DE JUNIO""",,M.R. A.,MONSEÑOR BOGARIN,URBANA,,R9,,N1,SECRETARÍA,1,ESSAP/SENASA,ANDE,EN GESTIÓN,SI,LA SECRETARIA FUNCIONA EN LA DIRECCION LO CUAL CONLLEVA UN DESEMPEÑO NO ADECUADO ,CENTRAL,11
207,1110043,18456,"EEB: 6566 ""12 DE JUNIO""",,M.R. A.,MONSEÑOR BOGARIN,URBANA,,R9,,N1,SALA DE PROFESORES,1,ESSAP/SENASA,ANDE,EN GESTIÓN,SI,LOS DOCENTES NO CUENTAN CON UN LUGAR DONDE REUNIRSE A PLANEAR Y ESPERAR SU HORARIO DE CLASES.,CENTRAL,11
213,1110043,18456,"EEB: 6566 ""12 DE JUNIO""",,M.R. A.,MONSEÑOR BOGARIN,URBANA,,R9,,N1,BIBLIOTECA,1,ESSAP/SENASA,ANDE,EN GESTIÓN,SI,"LOS NIÑOS/AS, JOVENES Y ADULTOS NECESITAN DE UN LUGAR DESTINADO A BIBLIOTECA.",CENTRAL,11
5,1110043,18456,COL. NAC. 12 DE JUNIO,,M.R. A.,MONSEÑOR BOGARIN,URBANA,,R9,N2,200,,2,SI,ANDE,,SI,FALTA DE SALA DE CLASE,CENTRAL,11
86,0,18467,ESC. BÁS. N° 7692  LA PALOMA,,CAPIATA,CAPIATA,URBANA,,R3,30,1° Y 3°CICLO,AULAS,2,ESSAP/SENASA,ANDE,SI,SI,SE COMPARTE CON DIRECCION,CENTRAL,11
419,0,18480,ESC. BÁS. N° 4697 NUEVA ASUNCIÓN,,LUQUE,CÑIA TARUMANDY – URBANIZACIÓN NUEVA ASUNSÚN,URBANA,,R2,350,E.I.,AULAS,4,OTRO,ANDE,CONSTANCIA SENAVITAD,SI,"ALA ADECUADA PARA EL 3º CICLO,DIRECCION,NIVEL INICIAL Y BIB,LIOTECA",CENTRAL,11
471,0,18480,ESC. BÁS. N° 4697 NUEVA ASUNCIÓN,,LUQUE,CÑIA TARUMANDY – URBANIZACIÓN NUEVA ASUNSÚN,URBANA,,R2,350,E.E.B. Y E.I.,"AULAS,DIRECCIÓN ",4,AGUATERIA,SI,C0NSTANCIA SENAVITAD,SI,"SALA PARA 3º CICLO,DIRECCCION,NIVEL INICIAL Y BIBLIOTECA",CENTRAL,11
367,1108055,18490,ESC. BÁS. N° 6560 NIÑO JESÚS ,,LIMPIO,BARRIO NIÑO JESÚS,URBANA,,R1,191,N1,BIBLIOTECA,1,AGUATERIA,ANDE,EN GESTIÓN,SI,DÉFICIT,CENTRAL,11
132,1108058,18501,ESC. BÁS. N° 5571 NUESTRA SEÑORA DE LA ASUNCIÓN,,LIMPIO,NUESTRA SEÑORA DE LA ASUNCIÓN,URBANA,,R1,28,N1,AULAS,1,AGUATERIA,ANDE,MEC,SI,CRECIMIENTO NATURAL,CENTRAL,11
92,0,18503,ESC. BÁS. N° 15390 SANTO DOMINGO,,CAPIATA,0,URBANA,,R3,240,3° CICLO,DIRECCIÓN,1,AGUATERIA,ANDE,NO,SI,NO SE CUENTA CON SALA PARA DIRECCION,CENTRAL,11
33,1102093,18506,ESC. BÁS. N° 15378 PROF. DR. LUIS MARIA ARGAÑA,,CAPIATA,KM. 23 RUTA 1 Bº LUIS ALBERTO DEL PARANA,URBANA,,R8,347,N1,CRA,1,ESSAP/SENASA,ANDE,MUNICIPAL,SI,PARA BRINDAR ESPACIOS PROPICIOS PARA EL APRENDIZAJE SIGNIFICATIVO Y GERENCIAR EL EQUIPAMIENTO CON MÁQUINAS DONADAS (5 COMPUTADORAS) A LA INSTITUCIÓN EL CUAL NO PODEMOS ARMAR POR FALTA DE ESPACIOS.,CENTRAL,11
380,1102090,18507,ESC. BÁS. N° 6254 SAN JUAN BAUTISTA,,CAPIATA,"KM. 19,5 RUTA 1 Bº SAN JUAN",URBANA,,R8,205,N1,AULAS,1,AGUATERIA,ANDE,MEC,SI,ES UNA NECESIDAD PORQUE UNA SAL DE CLASE ESTA COMPARTIDA,CENTRAL,11
464,1102091,18508,ESC. BÁS. N° 6557 SAN SEBESTIAN,,CAPIATA,KM. 20 RUTA 1 Bº KENNEDY,URBANA,,R8,406,N1,AULASS,3,AGUATERIA,ANDE,EN TRÁMITE,SI,POR FALTA DE SALAS DESTINADAS EXCLUSIVAMENTE AL 3ER CICLO,CENTRAL,11
466,1102091,18508,ESC. BÁS. N° 6557 SAN SEBESTIAN,,CAPIATA,KM. 20 RUTA 1 Bº KENNEDY,URBANA,,R8,460,N1,BIBLIOTECA,1,AGUATERIA,ANDE,EN TRÁMITE,SI,FALTA DE SALA DESTINADA PARA BIBLIOTECA.,CENTRAL,11
382,,28270,COL. NAC. SAN MIGUEL ARCANGEL,,SAN LORENZO,VILLA 24 DE JUNIO,URBANA,,R2,240,N2,LABORATORIO,7,AGUATERIA,ANDE,MEC,SI,DEFICIT,CENTRAL,11
159,1108063,18516,ESC. BÁS. N° 5890 ASCENCIÓN GONZÁLEZ DE ACOSTA ,,LIMPIO,VILLA SAN FRANCISCO,URBANA,,R1,60,N1,AULAS,3,AGUATERIA,ANDE,MEC,SI,PARA ALBERGAR A MÁS ALUMNOS,CENTRAL,11
504,,18547,ESC. BÁS. Nº 5969 COMUNITARIA,5969,CAPIATA,KM. 23 RUTA 1 YBYRARÓ,URBANA,,R8,48,N1,AULAS,1,AGUATERIA,ANDE,MEC,SI,PARA ALBERGAR A MAS  ALUMNOS,CENTRAL,11
235,10948,18559,ESC. BÁS. N° 6100 JAPONESA ,,AREGUÁ,BRISAS DEL LAGO,URBANA,,R3,350,N1,BIBLIOTECA,1,OTRO,ANDE,SI,SI,SE NECESITA UN ESPACIO PARA LA BIBLIOTECA PARA LA LECTURA Y APROVECHAMIENTO CULTURAL,CENTRAL,11
273,10948,18559,ESC. BÁS. N° 6100 JAPONESA ,,AREGUÁ,BRISAS DEL LAGO,URBANA,,R3,350,N1,DIRECCIÓN,1,OTRO,ANDE,SI,SI,SE NECESITA DE UN LUGAR DESTINADO PARA LOS TRABAJOS ADMINISTRATIVOS.,CENTRAL,11
313,10948,18559,ESC. BÁS. N° 6100 JAPONESA ,,AREGUÁ,BRISAS DEL LAGO,URBANA,,R3,350,N1,SECRETARÍA,1,OTRO,ANDE,SI,SI,SE NECESITA UN ESPACIO PARA LA SECRETARIA,CENTRAL,11
8,1107068,18563,"ESC. BÁS. N° 15268 ESC. BÁS. AVA MBA""E                               ",,LAMBARÉ,SAN JOSÉ,URBANA,SAN JOSÉ,R2,270,1,,,ESSAP/SENASA,ANDE,SÌ,SI,REPARACIÓN DEL TECHO EN PELIGRO DE DERRUMBE. MURALLA PERIMETRAL EN PELIGRO DE DERRUMBE,CENTRAL,11
34,1110047,18566,EEB: 4711 APOSENTO ALTO,,M.R. A.,SAN RAFAEL,URBANA,,R9,50,N1,AULASS,2,ESSAP/SENASA,ANDE,N O,SI,LA SUPERPOBLACIÓN DE ALUMNOS NOS OBLIGA A CONSTRUIR MAS AULAS Y NO CONTAMOS CON LOS RECURSOS NECESARIOS,CENTRAL,11
46,1110047,18566,EEB: 4711 APOSENTO ALTO,,M.R. A.,SAN RAFAEL,URBANA,,R9,16,N1,SALA DE PROFESORES,1,ESSAP/SENASA,ANDE,NO,SI,NO CONTAMOS CON UN LUGAR EXCLUSIVAMENTE PARA DOCENTES,CENTRAL,11
57,1110047,18566,EEB: 4711 APOSENTO ALTO,,M.R. A.,SAN RAFAEL,URBANA,,R9,200,N1,CRA,1,ESSAP/SENASA,ANDE,NO,SI,NOS RESULTA DIFICIL TRABAJAR SI NO CONTAMOS CON ESPACIOS DONDE LOS ALUMNOS PUEDAN BUSCAR INFORMACIONES DENTRO DE LA INSTITUCIÓN,CENTRAL,11
599,1110047,18566,EEB: 4711 APOSENTO ALTO,,M.R. A.,SAN RAFAEL,URBANA,,R9,50,N1,AULASS,2,ESSAP/SENASA,ANDE,N O,SI,LA SUPERPOBLACIÓN DE ALUMNOS NOS OBLIGA A CONSTRUIR MAS AULAS Y NO CONTAMOS CON LOS RECURSOS NECESARIOS,CENTRAL,11
601,1110047,18566,EEB: 4711 APOSENTO ALTO,,M.R. A.,SAN RAFAEL,URBANA,,R9,16,N1,SALA DE PROFESORES,1,ESSAP/SENASA,ANDE,NO,SI,NO CONTAMOS CON UN LUGAR EXCLUSIVAMENTE PARA DOCENTES,CENTRAL,11
603,1110047,18566,EEB: 4711 APOSENTO ALTO,,M.R. A.,SAN RAFAEL,URBANA,,R9,200,N1,CRA,1,ESSAP/SENASA,ANDE,NO,SI,NOS RESULTA DIFICIL TRABAJAR SI NO CONTAMOS CON ESPACIOS DONDE LOS ALUMNOS PUEDAN BUSCAR INFORMACIONES DENTRO DE LA INSTITUCIÓN,CENTRAL,11
451,0,18567,ESC. BÁS. N° 6216 ENMANUEL FUENTE DE ESPERANZA,,LUQUE,CÑIA LAURELTY CALLE L DE TRAS DE TOYOTOSCHI,URBANA,,R2,560,E.E.B.,AULAS,2,OTRO,ANDE,EN GESTION,SI,CRECIMIENTO NATURALIPA 9º GRADO,CENTRAL,11
574,1106060,18572,ESC. BÁS. N° 6393 URUNDEY,,ITAUGUA,ITAUGUA GUAZU,URBANA,,R4,170,E.E.B.,DIRECCIÓN,1,OTRO,ANDE,MEC,SI,LA DIRECCIÓN ES COMPARTIDA CON OTRA AULA,CENTRAL,11
576,1106060,18572,ESC. BÁS. N° 6393 URUNDEY,,ITAUGUA,ITAUGUA GUAZU,URBANA,,R4,20,E.E.B.,AULAS,1,OTRO,ANDE,MEC,SI,NO CONTAMOS CON AULA ACORDE PARA EL PREESCOLAR,CENTRAL,11
113,,18574,ESC. BÁSC. N° 6327 VICENTE AGÜERO,,CAPIATA,ROJAS CAÑADA,RURAL,1° DE MAYO,R3,150,3° Y N.M,AULAS,3,AGUATERIA,ANDE,EN PROCESO,SI,FALTA DE INFRAESTRUCTURA,CENTRAL,11
68,,18574,ESC. BÁSC. N° 6327 VICENTE AGÜERO,,CAPIATA,ROJAS CAÑADA,RURAL,1° DE MAYO,R3,150,3° Y N.M,AULAS,3,AGUATERIA,ANDE,EN PROCESO,SI,FALTA DE INFRAESTRUCTURA,CENTRAL,11
134,,18575,ESC. BÁSC. N° 6327 VICENTE AGÜERO,,CAPIATA,ROJAS CAÑADA,RURAL,1° DE MAYO,R3,150,3° Y N.M,DIRECCIÓN,1,AGUATERIA,ANDE,EN PROCESO,SI,NO SE CUENTA CON SALA PARA DIRECCION,CENTRAL,11
88,,18575,ESC. BÁSC. N° 6327 VICENTE AGÜERO,,CAPIATA,ROJAS CAÑADA,RURAL,1° DE MAYO,R3,150,3° Y N.M,DIRECCIÓN,1,AGUATERIA,ANDE,EN PROCESO,SI,NO SE CUENTA CON SALA PARA DIRECCION,CENTRAL,11
146,,18576,ESC. BÁSC. N° 6327 VICENTE AGÜERO,,CAPIATA,ROJAS CAÑADA,RURAL,1° DE MAYO,R3,150,3° Y N.M,SECRETARÍA,1,AGUATERIA,ANDE,EN PROCESO,SI,NO SE CUENTA CON SALA PARA SECRETARIA,CENTRAL,11
92,,18576,ESC. BÁSC. N° 6327 VICENTE AGÜERO,,CAPIATA,ROJAS CAÑADA,RURAL,1° DE MAYO,R3,150,3° Y N.M,SECRETARÍA,1,AGUATERIA,ANDE,EN PROCESO,SI,NO SE CUENTA CON SALA PARA SECRETARIA,CENTRAL,11
164,,18577,ESC. BÁSC. N° 6327 VICENTE AGÜERO,,CAPIATA,ROJAS CAÑADA,RURAL,1° DE MAYO,R3,150,3° Y N.M,BIBLIOTECA,1,AGUATERIA,ANDE,EN PROCESO,SI,NO SE CUENTA CON SALA PARA BIBLIOTECA,CENTRAL,11
104,,18577,ESC. BÁSC. N° 6327 VICENTE AGÜERO,,CAPIATA,ROJAS CAÑADA,RURAL,1° DE MAYO,R3,150,3° Y N.M,BIBLIOTECA,1,AGUATERIA,ANDE,EN PROCESO,SI,NO SE CUENTA CON SALA PARA BIBLIOTECA,CENTRAL,11
176,,18578,ESC. BÁSC. N° 6327 VICENTE AGÜERO,,CAPIATA,ROJAS CAÑADA,RURAL,1° DE MAYO,R3,150,3° Y N.M,SALA P/LABORATORIO,1,AGUATERIA,ANDE,EN PROCESO,SI,NO SE CUENTA CON SALA PARA LABORATORIO,CENTRAL,11
112,,18578,ESC. BÁSC. N° 6327 VICENTE AGÜERO,,CAPIATA,ROJAS CAÑADA,RURAL,1° DE MAYO,R3,150,3° Y N.M,SALA P/LABORATORIO,1,AGUATERIA,ANDE,EN PROCESO,SI,NO SE CUENTA CON SALA PARA LABORATORIO,CENTRAL,11
487,0,18579,ESC. BÁS. N° 6433  JÓVENES UNIDOS ,,LUQUE,CÑIA IATPUAMI – CALLE SILVESTRE JARA C/ BALDOMERO IRALA DUARTE,URBANA,,R2,20,E.E.B,AULAS,1,SENASA,ANDE,MEC,SI,CRECIMIENTO NATURAL IPA 9º GRADO,CENTRAL,11
463,0,18580,ESC. BÁS. N° 6359  SAN ANTONIO ,,LUQUE,CÑIA MARIN KAAGUY,URBANA,,R2,155,2°Y3° CICLO E.E.B,AULAS,3,SENASA,ANDE,MEC,SI,POBLACION DE MATRICULADOS EN AUMENTO,CENTRAL,11
398,0,18590,ESC. BÁS. N° 6418  MARÍA AUXILIADORA,,CAPIATA,CAPIATA,URBANA,,R3,250,"1°, 2° Y 3° CICLO",BIBLIOTECA,1,ESSAP/SENASA,ANDE,FISCAL,SI,FUNCIONA EN UN AULA,CENTRAL,11
123,1108079,18592,ESC. BÁS. N° 6439 VIRGEN DE CAACUPÉ,,LIMPIO,OSCAR S. NETTO,URBANA,,R1,450,N1,AULAS,3,AGUATERIA,ANDE,MEC,SI,DÉFICIT POR CRECIMIENTO NATURAL,CENTRAL,11
165,1110045,18594,EEB: 4736 RENACER,,M.R. A., LA ASUNCIÓN,URBANA,,R9,50,N1,AULAS,1,ESSAP/SENASA,ANDE,SI,SI,LA INSTITUCIÓN NECESITA DE AULA PARA EL 8º GRADO,CENTRAL,11
131,1102126,18595,ESC. BÁS. N° 6438 SANTA LUCIA,,CAPIATA,"KM. 17,5 RUTA 1 CAPIATA",URBANA,,R8,30,N1,AULAS,1,POZO ARTESIANO,ANDE,NO,SI,PARA ALBERGAR A MAS  ALUMNOS,CENTRAL,11
360,,18596,ESC. BÁSC. N° 6032 SAN RAMÓN,,CAPIATA,CAAGUY CUPE,URBANA,,R3,30,"1°, 2° Y 3° CICLO",BIBLIOTECA,1,ESSAP/SENASA,ANDE,EN PROCESO,SI,NO SE CUENTA CON SALA PARA BIBLIOTECA,CENTRAL,11
269,11533,18603,ESC. BÁS. N° 6414 SANTA MARÍA ,,AREGUÁ,CAACUPEMI,URBANA,"ASENTAMIENTO BELEN I,II,III",R3,412,N1,BIBLIOTECA,1,ESSAP/SENASA,ANDE,PRIVADO,SI,"LA INSTITUCION NO POSEE MEDIOS PARA LA CONSTRUCCIÓN DEBIDO A CUENTAS PENDIENTES DE LAS DEMAS CONSTRUCCIONES, LOS ALUMNOS NECESITAN DE UNA BIBLIOTECA BIEN EQUIPADA PARA RECAUDAR INFORMACIONES",CENTRAL,11
18,,,ESC. BÁS. Nº 514 STELLA MARIS,514,CONCEPCION,CHACO.I,RURAL,,1,93,E.E.B,AULAS,4,AGUA DE RIO,ANDE,SI,SI,CONTRUCCIÓN ANTIGUA,CONCEPCION,1
619,11533,18603,ESC. BÁS. N° 6414 SANTA MARÍA ,,AREGUÁ,CAACUPEMI,URBANA,"ASENTAMIENTO BELEN I,II,III",R3,412,N1,BIBLIOTECA,1,ESSAP/SENASA,ANDE,PRIVADO,SI,"LA INSTITUCION NO POSEE MEDIOS PARA LA CONSTRUCCIÓN DEBIDO A CUENTAS PENDIENTES DE LAS DEMAS CONSTRUCCIONES, LOS ALUMNOS NECESITAN DE UNA BIBLIOTECA BIEN EQUIPADA PARA RECAUDAR INFORMACIONES",CENTRAL,11
152,SIN C0DIG0,18611,ESC. BÁS. N° 6940 VIRGEN DE LAS MERCEDES,,CAPIATA,KM. 20 RUTA 1 VIRGEN DE LAS MERCEDES,URBANA,,R8,470,N1,DIRECCIÓN,1,POZO ARTESIANO,ANDE,MEC,SI,NO CUENTA CON DIRECCIÓN,CENTRAL,11
158,SIN C0DIG0,18611,ESC. BÁS. N° 6940 VIRGEN DE LAS MERCEDES,,CAPIATA,KM. 20 RUTA 1 VIRGEN DE LAS MERCEDES,URBANA,,R8,470,N1,AULAS,3,POZO ARTESIANO,ANDE,MEC,SI,NECESITA MAYOR CANTIDAD DE AULAS,CENTRAL,11
180,7561,18613,ESC. BÁS. N° 4762 CAMINO  SIÓN ,,AREGUÁ,ASENT. SANTA CATALINA,URBANA,ASENT. SANTA CATALINA,R3,100,N1,AULAS,2,ESSAP/SENASA,ANDE,EN GESTION,SI,DEFICIT,CENTRAL,11
605,7561,18613,ESC. BÁS. N° 4762 CAMINO  SIÓN ,,AREGUÁ,ASENT. SANTA CATALINA,URBANA,ASENT. SANTA CATALINA,R3,100,N1,AULAS,2,ESSAP/SENASA,ANDE,EN GESTION,SI,DEFICIT,CENTRAL,11
45,1102139,18617,ESC. BÁS. N° 6955 OSCAR AGUILERA,,CAPIATA,KM. 19 RUTA 1 Bº 8 DE DICIEMBRE,URBANA,8 DE DICIEMBRE,R8,236,N1,AULAS,3,POZO ARTESIANO,ANDE,S.A.S,SI,PARA ALBERGAR A MAS  ALUMNOS,CENTRAL,11
62,1102139,18617,ESC. BÁS. N° 6955 OSCAR AGUILERA,,CAPIATA,KM. 19 RUTA 1 Bº 8 DE DICIEMBRE,URBANA,8 DE DICIEMBRE,R8,236,N1,BIBLIOTECA,3,POZO ARTESIANO,ANDE,S.A.S,SI,ES DE SUMA IMPORTANCIA CONTAR CON BIBLIOTECA PARA BRINDAR ESPACIO PROPICIO PARA EL APRENDIZAJE,CENTRAL,11
29,0,18618,ESC. BÁS. N° 6867  MUNICIPAL SAN WENCESLAO,,CAPIATA,NARANJATY,URBANA,,R3,300,1° Y 3°CICLO,DIRECCIÓN,1,ESSAP/SENASA,ANDE,MUNICIPAL,SI,NO SE CUENTA CON SALA PARA DIRECCION,CENTRAL,11
53,0,18618,ESC. BÁS. N° 6867  MUNICIPAL SAN WENCESLAO,,CAPIATA,NARANJATY,URBANA,,R3,300,1° Y 3°CICLO,SECRETARÍA,1,ESSAP/SENASA,ANDE,MUNICIPAL,SI,NO SE CUENTA CON SALA PARA SECRETARIA,CENTRAL,11
65,0,18618,ESC. BÁS. N° 6867  MUNICIPAL SAN WENCESLAO,,CAPIATA,NARANJATY,URBANA,,R3,300,1° Y 3°CICLO,BIBLIOTECA,1,ESSAP/SENASA,ANDE,MUNICIPAL,SI,NO SE CUENTA CON SALA PARA BIBLIOTECA,CENTRAL,11
71,0,18618,ESC. BÁS. N° 6867  MUNICIPAL SAN WENCESLAO,,CAPIATA,NARANJATY,URBANA,,R3,300,1° Y 3°CICLO,MURALLA PERIMETRAL,1,ESSAP/SENASA,ANDE,MUNICIPAL,SI,FALTA DE INFRAESTRUCTURA,CENTRAL,11
416,1102141,18623,ESC. BÁS. N° 6954 SAN CAYETANO,,CAPIATA,KM. 23 RUTA 1 CÑIA. 7 YBYRARO,URBANA,SAN CAYETANO,R8,350,N1,AULASS,2,ESSAP/SENASA,ANDE,EN TRÁMITE,SI,CONTAR CON MÁS AULAS PARA DESDOBLAR LOS GRADOS CON EXCESIVA CANTIDAD DE ALUMNOS,CENTRAL,11
418,1102141,18623,ESC. BÁS. N° 6954 SAN CAYETANO,,CAPIATA,KM. 23 RUTA 1 CÑIA. 7 YBYRARO,URBANA,SAN CAYETANO,R8,350,N1,SECRETARÍA,1,ESSAP/SENASA,ANDE,EN TRÁMITE,SI,BRINDAR ESPACIO ADECUADO AL PLANTEL DOCENTE.,CENTRAL,11
420,1102141,18623,ESC. BÁS. N° 6954 SAN CAYETANO,,CAPIATA,KM. 23 RUTA 1 CÑIA. 7 YBYRARO,URBANA,SAN CAYETANO,R8,350,N1,BIBLIOTECA,1,ESSAP/SENASA,ANDE,EN TRÁMITE,SI,CONTAR CON UNA BIBLIOTECA PARA ELABORAR TRABAJOS GRUPALES EN LA INSTITUCIÓN.,CENTRAL,11
174,1110065,18627,EEB: 7078 LA AMISTAD,,M.R. A.,SAN BLAS,URBANA,LA AMISTAD,R9,60,N1,AULASS,2,ESSAP/SENASA,ANDE,NO,SI,LAS AULAS NO SON ACORDE AL NIVEL,CENTRAL,11
452,,18628,ESC. BÁSC. N° 6436 SANTA LUCIA,,CAPIATA,CAPIATA,,,R3,,E..INICIAL,AULAS,1,AGUATERIA,ANDE,MUNICIPAL,SI,SALA ESPECIAL PARA PRE-ESCOLAR,CENTRAL,11
107,0,18633,ESC. BÁS. N° 7204 SAN GREGORIO,,CAPIATA,0,URBANA,,R3,141,1° Y 2° CICLO,DIRECCIÓN,1,ESSAP/SENASA,ANDE,_,SI,NO SE CUENTA CON SALA PARA DIRECCION,CENTRAL,11
433,0,18634,ESC. BÁS. N° 6746  PORVENIR,,LUQUE,ASENTAMIENTO BONANZA – ISLA BOGADO,URBANA,,R2,407," 1º,2º,3º CICLO E.E.B",AULAS,5,OTRO,ANDE,EN GESTION,SI,,CENTRAL,11
170,1106065,18636,ESC. BÁS. N° 6942 SANTA CECILIA,,ITAUGUA,CÑIA. JHUGUA POTI,URBANA,,R4,170,E.E.B.,AULAS,1,AGUATERIA,ANDE,EN TRÁMITE,SI,TECHO DE LOZA DETERIORADO POR LA HUMEDAD Y LAS LLUVIAS,CENTRAL,11
415,0,18637,ESC. BÁS. N° 7076 ALIANZA,,LUQUE,ASENTAMIENTO ALIANZA UNIDA CÑIA ISLA BOGADO,URBANA,,R2,24,E.I.,AULAS,,OTRO,ANDE,EN GESTION,SI,LA INSTITUCION NO CUENTA CON AULA PARA EL PE,CENTRAL,11
555,0,18638,ESC. BÁS. N° 7228  NUEVO HORIZONTE  ,,LUQUE,CALLE- TAJY Y 5TA ASENTAMIENTO TARUMA,0,TARUMA,R2,20,E.E.B,AULAS,1,OTRO,ANDE,EN PROCESO,SI,PARA ALBERGAR A MÁS ALUMNOS.,CENTRAL,11
209,1108081,18647,ESC. BÁS. N° 7015  SAN RAMÓN ,,LIMPIO,URBANIZACIÓN PARQUE DEL NORTE,URBANA,,R1,70,N1,AULAS,3,AGUATERIA,ANDE,MEC,SI,DÉFICIT DE AULA PARA EL 3º CICLO,CENTRAL,11
24,   ,18699,ESC.BAS.Nº 2599 DON ZENON ORTIZ,2599,PJC,PORTERA ORTIZ,URBANA,          ,2,70,1º Y 2º C ,AULAS,3,POZO COMÚN,ANDE,EN GESTION,SI,EL TRASLADO TOTAL DE LA ESC. EN EL NUEVO ASENTAMIENTO,AMAMBAY,13
9,0,18718,ESC. BÁS. N° 7739  VIRGEN DEL CARMEN Y NIÑO JESÚS,,CAPIATA,ROJAS CAÑADA,URBANA,,R3,60,1° CICLO,AULAS,1,POZO ARTESIANO,ANDE,SAS,SI,FALTA DE INFRAESTRUCTURA,CENTRAL,11
372,16475,18719,E.E.B 7077 ESC. BÁS. Nº 7077 SAN FRANCISCO DE ASÍS,7077,ITÁ,CÑÍA. POTRERO PO´I,RURAL,POTRERO POÍ,R5,5,E.E.B,DIRECCIÓN,1,ESSAP/SENASA,NO POSEE,MEC,SI,MULTIPLES GESTIONES ADMINISTRATIVAS,CENTRAL,11
374,16475,18719,E.E.B 7077 ESC. BÁS. Nº 7077 SAN FRANCISCO DE ASÍS,7077,ITÁ,CÑÍA. POTRERO PO´I,RURAL,POTRERO POÍ,R5,76,E.E.B,BIBLIOTECA,1,ESSAP/SENASA,NO POSEE,MEC,SI,ELEVAR EL NIVEL DE LECTO ESCRITURA,CENTRAL,11
72,,18753,ESC. BÁS. Nº 2.320 INDEPENDENCIA NACIONAL,2320,SGTO. JOSÉ F. LÓPEZ,PUENTESIÑO,RURAL,,2,100,E.E.B 3º CICLO,AULAS,3,SENASA,ANDE,MEC,SI,PORQUE LOS ALUMNOS TRABAJAN BAJOS LOS ARBOLES,CONCEPCION,1
4,13783,18797,ESC. BÁS. N° 7316 VIRGEN DE LA CANDELARIA,,VILLA ELISA,CENTRO,URBANA,,R3,,E.I. Y E.E.B.,AULAS,2,AGUATERIA,ANDE,SI,SI,NECESIDAD DE CONTAR CON UN AULA PARA OFRECER MAS OPORTUNIDADES PARA NIÑOS DE LA COMUNIDAD.,CENTRAL,11
61,,18822,ESC. BAS. Nº 188 BELLA VISTA ,188,BELLA VISTA ,OBRERO ,RURAL,OFICIAL,4,36,INICIAL,,,ESSAP,ANDE ,TIENE ,SI,UN AULA CON SANITARIO PARA EL JARDIN Y PREESCOLAR CON MUEBLES ,AMAMBAY,13
401,1108059,18846,ESC. BÁS. N° 6559 JESÚS MISERICORDIOSO ,,LIMPIO,URBANIZACIÓN EL PEÑÓN,URBANA,,R1,208,N1,AULAS,1,ESSAP/SENASA,ANDE,EN GESTIÓN,SI,POR LA DEMANDA DE LA MATRICULA EXISTENTE EN LA ESCUELA,CENTRAL,11
403,1108059,18846,ESC. BÁS. N° 6559 JESÚS MISERICORDIOSO ,,LIMPIO,URBANIZACIÓN EL PEÑÓN,URBANA,,R1,208,N1,SALA DE PROFESORES,1,ESSAP/SENASA,ANDE,EN GESTIÓN,SI,POR LA DEMANDA DE LA MATRICULA EXISTENTE EN LA ESCUELA,CENTRAL,11
405,1108059,18846,ESC. BÁS. N° 6559 JESÚS MISERICORDIOSO ,,LIMPIO,URBANIZACIÓN EL PEÑÓN,URBANA,,R1,208,N1,BIBLIOTECA,1,ESSAP/SENASA,ANDE,EN GESTIÓN,SI,POR LA DEMANDA DE LA MATRICULA EXISTENTE EN LA ESCUELA,CENTRAL,11
407,1108059,18846,ESC. BÁS. N° 6559 JESÚS MISERICORDIOSO ,,LIMPIO,URBANIZACIÓN EL PEÑÓN,URBANA,,R1,208,N1,LABORATORIO,1,ESSAP/SENASA,ANDE,EN GESTIÓN,SI,POR LA DEMANDA DE LA MATRICULA EXISTENTE EN LA ESCUELA,CENTRAL,11
49,1301153,18957,ESC.BAS.Nº 7375 SAN ROQUE GONZALEZ DE SANTACRUZ,7375,PJC,FRACCION LIBERTAD,URBANA,         ,1,120,EI ,AULAS,1,POZO ARTESIANO,ANDE,MEC,SI,SE NECESITA UN AULA EXCLUSIVO PARA PRE CON BAÑO DIFERENCIADO,AMAMBAY,13
50,1301153,18957,ESC.BAS.Nº 7375 SAN ROQUE GONZALEZ DE SANTACRUZ,7375,PJC,FRACCION LIBERTAD,URBANA,         ,1,120,E.E.B,DIRECCIÓN,1,POZO ARTESIANO,ANDE,MEC,SI,SE NECESITA ESTE ESPACIO EN LA INSTITUCION,AMAMBAY,13
51,1301153,18957,ESC.BAS.Nº 7375 SAN ROQUE GONZALEZ DE SANTACRUZ,7375,PJC,FRACCION LIBERTAD,URBANA,         ,1,120,E.E.B,"COCINA,COMEDOR",1,POZO ARTESIANO,ANDE,MEC,SI,PARA SERVIR EL COMPLEMENTO NUTRICIONAL,AMAMBAY,13
204,,18972,ESCUELA BASICA N° 7087 EL BUEN SEMBRADOR,,CAPIATA,CAPIATA,URBANA,,R3,30,"1° ,2°Y 3° CICLO",AULAS,2,AGUATERIA,ANDE,SAS,SI,PARA PRE-ESCOLAR-SALA DE PROFESORES,CENTRAL,11
214,,18973,ESCUELA BASICA N° 7087 EL BUEN SEMBRADOR,,CAPIATA,CAPIATA,URBANA,,R3,31,"1° ,2°Y 3° CICLO",BIBLIOTECA,1,AGUATERIA,ANDE,SAS,SI,NO SE CUENTA CON SALA PARA BIBLIOTECA,CENTRAL,11
224,,18974,ESCUELA BASICA N° 7087 EL BUEN SEMBRADOR,,CAPIATA,CAPIATA,URBANA,,R5,32,"1° ,2°Y 3° CICLO",SALA P/LABORATORIO,1,AGUATERIA,ANDE,SAS,SI,NO SE CUENTA CON SALA PARA LABORATORIO,CENTRAL,11
468,1102158,18985,ESC. BÁS. N° 7626 13 BELEN,,CAPIATA,KM. 20 RUTA 1 Bº KENNEDY,URBANA,,R8,30,N1,AULAS,1,AGUATERIA,ANDE,MUNICIPAL,SI,LA INSTITUCIÓN NO CUENTA CON UN AULA DESTINADA EXCLUSIVAMENTE PARA NIVEL INICIAL.,CENTRAL,11
470,1102158,18985,ESC. BÁS. N° 7626 13 BELEN,,CAPIATA,KM. 20 RUTA 1 Bº KENNEDY,URBANA,,R8,20,N1,AULAS,1,AGUATERIA,ANDE,MUNICIPAL,SI,CRECIMIENTO NATURAL DE LOS GRADOS QUE VAN A NECESITAR SALA DE CLASES,CENTRAL,11
,,19000,"ESC. BÁS. Nº 7.775""SIETE ESTRELLAS""","7775""Siete",MCAL. ESTIG.,FELICIANO SALDÍVAR EX DIEZ KUE,RURAL,FELICIANO SALDÍVAR EX DIEZ KUE,R-2,26,"1º, 2º E.E.B",DIRECCIÓN/AULAS,4,ALJIBE,NO,COM. INDÍGENA,SI,"LA INSTITUCIÓN NO TIENE NINGUNA CONSTRUCCIÓN, PLANO NO.",BOQUERON,16
8,9926,19506,ESC.BAS. N°. 452 HAYDEE LÓPEZ DE FILIPPI,,JOSÉ FALCÓN,SANTA ROSA,URBANA,,R.1,195,E.E.B,"AULAS   PE       , BIBLIOTECA     , LABORATORIO",3,PRIVADO,ANDE,M.E.C,SI,NO CUENTA CON ESTE ESPACIO,PDTE. HAYES,15
26,10017,19508,ESC. BAS.N°. 247 CAP. DE NAV. PEDRO .IGNACIO MEZA,,NANAWA,INDEPENDIENTE,URBANA,,R.1,18,P.E,AULAS,3,PRIVADO,ANDE,M.E.C,SI,DEFICIF,PDTE. HAYES,15
14,10147,19509,COLEGIO NAC. SILVESTRE MARTINEZ,,NANAWA,SAN MIGUEL,URBANA,,R.1,215,E. M Y T,"DIERCCIÓN       , BIBLIOTECA    , LABORATORIO",3,PRIVADO,ANDE,M.E.C,SI,LA INSTITUCIÓN NO CUENTA CON ESTE ESPACIO,PDTE. HAYES,15
17,10147,19509,COLEGIO NAC. SILVESTRE MARTINEZ,,NANAWA,SAN MIGUEL,URBANA,,R.1,215,E. M Y T,"DIERCCIÓN       , BIBLIOTECA    , LABORATORIO",3,PRIVADO,ANDE,M.E.C,SI,LA INSTITUCIÓN NO CUENTA CON ESTE ESPACIO,PDTE. HAYES,15
1,9931,19515,ESC. BAS. N°. 763 GASPAR RODRIGUEZ DE FRANCIA,,GRAL. BRUGUEZ,TABLERO,RURAL,,R.1,10,3°. CICLO,AULAS,3,ALJIBE,,M.E.C,SI,NO CUENTA CON AULAS PARA EL 3°. CICLO,PDTE. HAYES,15
10,17505,19521,1273 SALTO PALMAR,,TTE. E. MARTINEZ,CABO CANO,RURAL,,1,15,E.E.B,AULAS,1,TANQUE,2 AULA,MEC,SI,DIFICIT DE LOCAL,PDTE. HAYES,15
,,19572,"ESC. BÁS. Nº 6939 ""1º DE MARZO""",,TTE. 1º IRALA FERNÁNDEZ,TTE 1° I FERNÁNDEZ,RURAL,COMUNIDAD ANGAITE DE 10 LEGUAS,R-3,31,E.E.B,AULAS,1,,,COMUNITARIO INDÍGENA,SI,LA INSTITUCIÓN NO CUENTA CON AULAS SEGURAS,BOQUERON,16
,,19586,"ESC. BÁS. SUBV. N° 5.816""MCAL. FRANCISCO SOLANO LÓPEZ""",,LOMA PLATA,CAMPO NUEVO,RURAL,YALVE SANGA,R-3,32,E.E.B,SANITARIOS PARA ESTUDIANTES,2,ALJIBE,ANDE,COMUNITARIO INDÍGENA,SI,"*LOS ALUMNOS/AS ASISTEN EN CLASE EN UN   EDIFICIO MUY DETERIORADO Y CON RIESGO A DERRUMBE, DE ESTA FORMA LOS NIÑOS/AS CORREN PELIGRO.  EL  ESPACIO DEDICADO A AULA TAMBIÉN ES UTILIZADO COMO DEPÓSITO, COCINA Y COMEDOR EN TIEMPO DE INVIERNO.",BOQUERON,16
,,19586,"ESC. BÁS. SUBV. N° 5.816""MCAL. FRANCISCO SOLANO LÓPEZ""",,LOMA PLATA,CAMPO NUEVO,RURAL,YALVE SANGA,R-3,32,E.E.B,VIVIENDA PARA PROFESORES,3,ALJIBE,ANDE,COMUNITARIO INDÍGENA,SI,"*LOS ALUMNOS/AS ASISTEN EN CLASE EN UN   EDIFICIO MUY DETERIORADO Y CON RIESGO A DERRUMBE, DE ESTA FORMA LOS NIÑOS/AS CORREN PELIGRO.  EL  ESPACIO DEDICADO A AULA TAMBIÉN ES UTILIZADO COMO DEPÓSITO, COCINA Y COMEDOR EN TIEMPO DE INVIERNO.",BOQUERON,16
,,19586,"ESC. BÁS. SUBV. N° 5.816""MCAL. FRANCISCO SOLANO LÓPEZ""",,LOMA PLATA,CAMPO NUEVO,RURAL,YALVE SANGA,R-3,32,E.E.B,ALJIBES,3,ALJIBE,ANDE,COMUNITARIO INDÍGENA,SI,"*LOS ALUMNOS/AS ASISTEN EN CLASE EN UN   EDIFICIO MUY DETERIORADO Y CON RIESGO A DERRUMBE, DE ESTA FORMA LOS NIÑOS/AS CORREN PELIGRO.  EL  ESPACIO DEDICADO A AULA TAMBIÉN ES UTILIZADO COMO DEPÓSITO, COCINA Y COMEDOR EN TIEMPO DE INVIERNO.",BOQUERON,16
,,19586,"ESC. BÁS. SUBV. N° 5.816""MCAL. FRANCISCO SOLANO LÓPEZ""",,LOMA PLATA,CAMPO NUEVO,RURAL,YALVE SANGA,R-3,32,E.E.B,AULAS,2,ALJIBE,ANDE,COMUNITARIO INDÍGENA,SI,"*LOS ALUMNOS/AS ASISTEN EN CLASE EN UN   EDIFICIO MUY DETERIORADO Y CON RIESGO A DERRUMBE, DE ESTA FORMA LOS NIÑOS/AS CORREN PELIGRO.  EL  ESPACIO DEDICADO A AULA TAMBIÉN ES UTILIZADO COMO DEPÓSITO, COCINA Y COMEDOR EN TIEMPO DE INVIERNO.",BOQUERON,16
,,19586,"ESC. BÁS. SUBV. N° 5.816""MCAL. FRANCISCO SOLANO LÓPEZ""",,LOMA PLATA,CAMPO NUEVO,RURAL,YALVE SANGA,R-3,32,E.E.B,"COCINA,COMEDOR",1,ALJIBE,ANDE,COMUNITARIO INDÍGENA,SI,"*LOS ALUMNOS/AS ASISTEN EN CLASE EN UN   EDIFICIO MUY DETERIORADO Y CON RIESGO A DERRUMBE, DE ESTA FORMA LOS NIÑOS/AS CORREN PELIGRO.  EL  ESPACIO DEDICADO A AULA TAMBIÉN ES UTILIZADO COMO DEPÓSITO, COCINA Y COMEDOR EN TIEMPO DE INVIERNO.",BOQUERON,16
,,19642,ESC. BÁS. N°5826 PAZ DEL CHACO,,TTE. 1º IRALA FERNÁNDEZ,TTE 1° I FERNÁNDEZ,RURAL,,R-3,98,E.E.B,"BIBLIOTECA, AULAS DIRECCIÓN",3,ALJIBE,ANDE,NO,SI,CRECIMIENTO NATURAL. LOS 3 ESPACIOS SOLICITADOS FUNCIONAN EN UNA SOLA PIEZA,BOQUERON,16
,,19643,"ESC. BÁS. N° 5828 ""EMA EEMEC""",,TTE. 1º IRALA FERNÁNDEZ,TTE 1° I FERNÁNDEZ,RURAL,,R-3,102,E.E.B,"BIBLIOTECA, AULA",3,ALJIBE,ANDE,NO,SI,PARA EL MANTENIMIENTO DE LOS MATERIALES DE CONSULTA. PARA EVITAR LA AGLOMERACIÓN,BOQUERON,16
,,19644,"ESC. BÁS. N° 6972 ""EL RIACHO""",,TTE 1° I FERNÁNDEZ,PAZ DEL CHACO,RURAL,PAZ DEL CHACO,R-3,33,E.E.B,AULAS,2,ALJIBE,,COMUNITARIO INDÍGENA,SI,PARA EL MANTENIMIENTO DE LOS MATERIALES DE CONSULTA. PARA EVITAR LA AGLOMERACIÓN,BOQUERON,16
,,19645,"ESC. BÁS. Nº 6775 ""19 DE ABRIL""",6775,TTE. 1º IRALA FERNÁNDEZ,TTE 1° I FERNÁNDEZ,RURAL,COMUNIDAD NIVACLE DE NICH'A TOYISH,R-3,89,E.E.B,AULAS,1,,ANDE,COMUNITARIO INDÍGENA,SI,LA INSTITUCIÓN NO CUENTA CON AULAS SEGURAS,BOQUERON,16
24,,19699,ESC.BAS.Nº  1459 TUPASY RENDA,,PUERTO PINASCO,TUPASY RENDA,RURAL,TUPASY RENDA,5,20,E.I- ,E.I,1,TAJAMAR,NO,NO,SI,POR DEFICIT,PDTE. HAYES,15
24,_,21021,"COL. NAC. ""SANTA ROSA""",,SANTA ROSA DEL AGUARAY,B° VIRGEN DE FÁTIMA,URBANA,,4,1000,NM,AULAS,6,SENASA,ANDE,MEC,SI,NO SE CUENTA CON AULAS PARA TODOS LOS CURSOS PARA ALBERGAR MÁS ALUMNOS.,SAN PEDRO,2
206,213027,21036,COLEGIO NACIONAL GRAL. BERNARDINO CABALLERO ,,VILLA DEL ROSARIO,PUERTO ROSARIO,URBANA, ,1,200,E.E.B - E.M ,AULAS,6,SENASA,ANDE,MEC,SI,"SE 12,000 MT2 DE TERRENO CON TITULO MEC",SAN PEDRO,2
,,19775,"ESC. BÁS. N° 1.158 ""ABRAM KLASSEN""",,LOMA PLATA,CESARÉA,RURAL,YALVE SANGA,R-3,10,E.E.B,DIRECCIÓN DE ÁREA,1,ALJIBE,ANDE,COMUNITARIO INDÍGENA,SI,"*ES URGENTE CONTAR CON ESTE ESPACIO EN EL LOCAL DEL CENTRO EDUCATIVO DEL ÁREA 1 CESARÉA-YALVE SANGA PARA LA ENTREGA DE ORIENTACIONES PEDAGÓGICAS Y ADMINISTRATIVAS A DIRECTORES Y DOCENTES, YA SEA PARA LOS CÍRCULOS DE APRENDIZAJES, JORNADAS DE CAPACITACIONES, OLYMPIADAS, COMPETENCIAS DE SABERES DE ESTUDIANTES,CHARLAS ZONALES, ENCUENTROS ENTRE DIRECTIVOS, DOCENTES Y LÍDERES INDÍGENAS  ENTRE OTROS QUE INVOLUCRA A MÁS 978 ALUMNOS/AS, 45 DOCENTES SIN CONTAR A LA FAMILIA DE LOS ESTUDIANTES.  ",BOQUERON,16
