141,,,"ESC. BÁS. N° 2068 ""SAN ROQUE G. DE S. CRUZ""",,HORQUETA,SALINAS CUÉ,RURAL,,4,33,E.E.B.,AULAS,2,POZO ARTESIANO,ANDE,MEC,SI,PARA ALBERGAR A MÁS ALUMNOS/AS,CONCEPCION,1
142,,,"ESC. BÁS. N° 4357 ""HNO. JOSÉ LUIS  ARBUÉS""",,HORQUETA,CALLEJÓN BELÉN,RURAL,COL. JUAN M. FRUTOS,4,33,E.E.B.,AULAS,2,POZO ARTESIANO,ANDE,MEC,SI,PARA ALBERGAR A MÁS ALUMNOS/AS,CONCEPCION,1
143,,,"ESC. BÁS. N° 2073 ""SAN MIGUEL""",,HORQUETA,SAN MIGUEL,RURAL,,4,40,E.E.B.,AULAS,2,POZO ARTESIANO,ANDE,MEC,SI,PARA ALBERGAR A MÁS ALUMNOS/AS,CONCEPCION,1
144,,,"ESC. BÁS. N° 4348 ""SAN JORGE""",,HORQUETA,SAN JORGE - CALLE 11,RURAL,COL. ORO VERDE,4,50,E.E.B.,AULAS,2,POZO ARTESIANO,ANDE,MEC,SI,PARA MEJORAR LOS ASPECTOS ESTÉTICOS DE LA CONSTRUCCIÓN,CONCEPCION,1
145,,,"ESC. BÁS. N° 4346 ""GRAL. ELIZARDO AQUINO""",,HORQUETA,TOLDO CUÉ - CALLE 9,RURAL,COL. JUAN M. FRUTOS,4,50,E.E.B.,AULAS,2,POZO ARTESIANO,ANDE,MEC,SI,PARA ALBERGAR A MÁS ALUMNOS/AS,CONCEPCION,1
146,,,"ESC. BÁS. N° 4351 ""HÉROES DEL CHACO""",,HORQUETA,TOTORA,RURAL,,4,18,E.E.B.,AULAS,1,POZO ARTESIANO,ANDE,MEC,SI,POR ATENTAR CONTRA  LA VIDA DE LOS ALUMNOS/AS,CONCEPCION,1
147,,,"ESC. BÁS. N° 4350 ""PROF. PORFIRIO CHAMORRO""",,HORQUETA,SANTA CATALINA,RURAL,COL. EX  COMBATIENTE,4,45,E.E.B.,AULAS,2,POZO ARTESIANO,ANDE,MEC,SI,POR ATENTAR CONTRA  LA VIDA DE LOS ALUMNOS/AS,CONCEPCION,1
148,,,"ESC. BÁS. N° 2460 ""NIÑO MILAGROSO""",,HORQUETA,COLONIA CHOFERES DEL CHACO,RURAL,COLONIA CHOFERES DEL CHACO,4,58,E.E.B.,AULAS,1,POZO ARTESIANO,ANDE,MEC,SI,PARA MEJORAR LOS ASPECTOS ESTÉTICOS DE LA CONSTRUCCIÓN,CONCEPCION,1
149,,,"ESC. BÁS. N° 4598 ""EL PARAGUAYO INDEPENDIENTE""",,HORQUETA,ESPAGÍN - B°ARRIO SAN BLAS,RURAL,,4,15,E.E.B.,AULAS,1,POZO ARTESIANO,ANDE,MEC,SI,PARA ALBERGAR A MÁS ALUMNOS/AS,CONCEPCION,1
150,,,"ESC. BÁS. N° 443 ""MAYOR JULIO D. OTAÑO""",,HORQUETA,ARROYITO,RURAL,COL. EX  COMBATIENTE,4,35,E.E.B.,BIBLIOTECA,1,SENASA,ANDE,MEC,SI,DÉFICIT,CONCEPCION,1
151,,,"ESC. BÁS. N° 4347 ""SAN ROQUE G. DE S. CRUZ""",,HORQUETA,CALLE 11 - ALEMÁN CUÉ,RURAL,COL. SAN ROQUE GONZÁLEZ,4,35,E.E.B.,BIBLIOTECA,1,SENASA,ANDE,MEC,SI,DÉFICIT,CONCEPCION,1
152,,,"ESC. BÁS. N° 1712 ""FULGENCIO YEGROS""",,HORQUETA,ALFONSO CUÉ,RURAL,COL. JUAN M. FRUTOS,4,35,E.E.B.,BIBLIOTECA,1,SENASA,ANDE,MEC,SI,DÉFICIT,CONCEPCION,1
153,,,"ESC. BÁS. N° 1709 ""DON CARLOS A. LÓPEZ""",,HORQUETA,CALLE 11 - 25 DE ABRIL,RURAL,,4,150,E.E.B.,BIBLIOTECA,1,POZO ARTESIANO,ANDE,MEC,SI,DÉFICIT,CONCEPCION,1
154,,,"ESC. BÁS. N° 28 ""PRÓCERES DE MAYO""",,HORQUETA,B° LAS PALMAS,URBANA,,4,50,E.E.B.,SALA DE PROFESORES,1,SENASA,ANDE,MEC,SI,DÉFICIT,CONCEPCION,1
155,,,"COL. NAC.  ""PERPETUO SOCORRO""",,HORQUETA,ASENTAMIENTO CALLE 9 - ALEMÁN CUÉ,RURAL,ALEMÁN CUÉ,4,44,EDUC. MEDIA,AULAS,2,POZO ARTESIANO,ANDE,MEC,SI,DÉFICIT,CONCEPCION,1
156,,,COL. NAC. JORGE SEBASTIÁN MIRANDA,,HORQUETA,BARRIO LAS PALMAS,URBANA,,4,80,EDUC. MEDIA,AULAS,2,SENASA,ANDE,MEC,SI,PARA MEJORAR LOS ASPECTOS ESTÉTICOS DE LA CONSTRUCCIÓN,CONCEPCION,1
157,,,COL. NAC. SAN LUIS GONZAGA,,HORQUETA,COSTA ROMERO,RURAL,,4,40,EDUC. MEDIA,AULAS,2,POZO ARTESIANO,ANDE,MEC,SI,PARA MEJORAR LOS ASPECTOS ESTÉTICOS DE LA CONSTRUCCIÓN,CONCEPCION,1
158,,,"COL. NAC. ""DON CARLOS A. LÓPEZ""",,HORQUETA,CALLE 11 - 25 DE ABRIL,RURAL,,4,25,EDUC. MEDIA,AULAS,1,POZO ARTESIANO,ANDE,MEC,SI,PARA ALBERGAR A MÁS ALUMNOS/AS,CONCEPCION,1
159,,,"COL. NAC. ""SAN IGNACIO""",,HORQUETA,COLONIA EX - COMBATIENTE,RURAL,EX  COMBATIENTE,4,35,EDUC. MEDIA,AULAS,1,SENASA,ANDE,MEC,SI,PARA MEJORAR LOS ASPECTOS ESTÉTICOS DE LA CONSTRUCCIÓN,CONCEPCION,1
160,,,COL. NAC. HÉROES DEL CHACO,,HORQUETA,CEPINGO CAÑADA ,RURAL,,4,60,EDUC. MEDIA,BIBLIOTECA,1,POZO ARTESIANO,ANDE,MEC,SI,DÉFICIT,CONCEPCION,1
161,,,COL. NAC. EDELMIRA TORRES BLANCO,,HORQUETA,PASO MBUTÚ,RURAL,,4,1,EDUC. MEDIA,DIRECCIÓN,1,POZO ARTESIANO,ANDE,MEC,SI,DÉFICIT,CONCEPCION,1
162,,,"COL. NAC. ""PRÓCERES DE MAYO""",,HORQUETA,B° LAS PALMAS,URBANA,,4,1,EDUC. MEDIA,DIRECCIÓN,1,SENASA,ANDE,MEC,SI,DÉFICIT,CONCEPCION,1
163,,,"COL. NAC. ""12 DE ABRIL""",,HORQUETA,ASENTAMIENTO N° 3  - ARROYITO,RURAL,COL. VIRGEN DEL CAMINO,4,70,EDUC. MEDIA,AULAS,3,POZO ARTESIANO,ANDE,MEC,SI,DÉFICIT,CONCEPCION,1
164,,,"""",,HORQUETA,ASENTAMIENTO N° 3  - ARROYITO,RURAL,COL. VIRGEN DEL CAMINO,4,1,EDUC. MEDIA,DIRECCIÓN,1,POZO ARTESIANO,ANDE,MEC,SI,DÉFICIT,CONCEPCION,1
165,,,"""",,HORQUETA,ASENTAMIENTO N° 3  - ARROYITO,RURAL,COL. VIRGEN DEL CAMINO,4,1,EDUC. MEDIA,SECRETARÍA,1,POZO ARTESIANO,ANDE,MEC,SI,DÉFICIT,CONCEPCION,1
166,,,"""",,HORQUETA,ASENTAMIENTO N° 3  - ARROYITO,RURAL,COL. VIRGEN DEL CAMINO,4,70,EDUC. MEDIA,BIBLIOTECA,1,POZO ARTESIANO,ANDE,MEC,SI,DÉFICIT,CONCEPCION,1
167,,,"COL. NAC. ""MAYOR JULIO D. OTAÑO""",,HORQUETA,ARROYITO,RURAL,EX  COMBATIENTE,4,60,EDUC. MEDIA,AULAS,3,SENASA,ANDE,MEC,SI,DÉFICIT,CONCEPCION,1
168,,,"""",,HORQUETA,ARROYITO,RURAL,EX  COMBATIENTE,4,1,EDUC. MEDIA,DIRECCIÓN,1,SENASA,ANDE,MEC,SI,DÉFICIT,CONCEPCION,1
169,,,"""",,HORQUETA,ARROYITO,RURAL,EX  COMBATIENTE,4,1,EDUC. MEDIA,SECRETARÍA,1,SENASA,ANDE,MEC,SI,DÉFICIT,CONCEPCION,1
170,,,"""",,HORQUETA,ARROYITO,RURAL,EX  COMBATIENTE,4,60,EDUC. MEDIA,BIBLIOTECA,1,SENASA,ANDE,MEC,SI,DÉFICIT,CONCEPCION,1
171,,,ESCUELA BÁSICA N° 2743,,SAN LÁZARO,VALLEMÍ,URBANA,,R5 Z7,25,E.E.B,AULAS,1,SI,SI,NO,SI,,CONCEPCION,1
172,,,LICEO NACIONAL SAN LAZARO,,SAN LÁZARO,SAN LAZARO,URBANA,,R5 Z7,50,E.E.B 3ER CICLO,AULAS,2,SI,SI,NO,SI,,CONCEPCION,1
173,,,LICEO NACIONAL TRES CERROS,,SAN LÁZARO,TRES CERROS,RURAL,,R5 Z7,25,E.E.B. 3ER CICLO,AULAS,1,SI,SI,NO,SI,,CONCEPCION,1
177,,,CENTRO 1-75,,YBY YAU,YBY YAU,URBANA,,6,-,EP,AULAS,1,J. DE SANEAMIENTO,ANDE,MEC,SI,PARA ALBERGAR A MAS ALUMNOS,CONCEPCION,1
180,,,"CENTRO REGIONAL DE EDUCACIÓN ""JUAN E. O`LEARY""",,CONCEPCIÓN,CONCEPCIÓN,URBANA,,-,120,BACH. TÉC. HOTELERIA Y TURISMO,AULAS,3,ESSAP - POZO ARTESIANO,ANDE,MEC,SI,LA ESPECIALIDAD NO CUENTA CON AULAS PROPIAS,CONCEPCION,1
181,,,"CENTRO REGIONAL DE EDUCACIÓN ""JUAN E. O`LEARY""",,CONCEPCIÓN,CONCEPCIÓN,URBANA,,-,120,BACH. TÉC. HOTELERIA Y TURISMO,LABORATORIO,1,ESSAP - POZO ARTESIANO,ANDE,MEC,SI,LA ESPECIALIDAD NO CUENTA CON LABORATORIO,CONCEPCION,1
182,,,"CENTRO REGIONAL DE EDUCACIÓN ""JUAN E. O`LEARY""",,CONCEPCIÓN,CONCEPCIÓN,URBANA,,-,120,BACH. TÉC. CONSTRUCCIONES CIVILES,AULAS,3,ESSAP - POZO ARTESIANO,ANDE,MEC,SI,LA ESPECIALIDAD NO CUENTA CON AULAS PROPIAS,CONCEPCION,1
183,,,"CENTRO REGIONAL DE EDUCACIÓN ""JUAN E. O`LEARY""",,CONCEPCIÓN,CONCEPCIÓN,URBANA,,-,120,BACH. TÉC. CONSTRUCCIONES CIVILES,LABORATORIO,1,ESSAP - POZO ARTESIANO,ANDE,MEC,SI,LA ESPECIALIDAD NO CUENTA CON LABORATORIO,CONCEPCION,1
184,,,"CENTRO REGIONAL DE EDUCACIÓN ""JUAN E. O`LEARY""",,CONCEPCIÓN,CONCEPCIÓN,URBANA,,-,120,BACH. TÉC. EN CC Y EN H Y T,DIRECCIÓN,1,ESSAP - POZO ARTESIANO,ANDE,MEC,SI,LA ESPECIALIDAD NO CUENTA CON UNA SALA DESTINADA A DIRECCIÓN,CONCEPCION,1
185,,,"CENTRO REGIONAL DE EDUCACIÓN ""JUAN E. O`LEARY""",,CONCEPCIÓN,CONCEPCIÓN,URBANA,,-,120,BACH. TÉC. EN CC Y EN H Y T,SECRETARÍA,1,ESSAP - POZO ARTESIANO,ANDE,MEC,SI,LA ESPECIALIDAD NO CUENTA CON UNA SALA DESTINADA A SECRETARÍA,CONCEPCION,1
3,_,,ESC. BCA N° 4993 NIÑO JESUS,,LIBERACIÓN,NIÑO JESUS,RURAL,,3,80,E.E.B,,3,SENASA,ANDE,MEC,SI,POR DÉFCIT,SAN PEDRO,2
13,_,,ESC. BCA N° 3874 SAN ANTONIO DE PADUA,,CHORE,SAN ANTONIO,RURAL,,6,,E.EB,AULAS,3,SENASA,ANDE,MEC,SI,POR DEFICIT,SAN PEDRO,2
30,214012,,COL. NAL SAN ANTONIO,,NUEVA GERMANIA,ISLA SOLA,RURAL,,2,67,E.E.B ,AULAS,3,SENASA,ANDE,MEC,SI,DÉFICIT,SAN PEDRO,2
35,_,,SUPERVISIÓN ADMINISTRATIVA,,NUEVA GERMANIA,SAN FELIPE,URBANA,,2,,,,,SENASA,ANDE,MEC,SI,DÉFICIT,SAN PEDRO,2
77,_,,"ESC. BÁS. N° 6551 ""SAN LORENZO""",,SANTA ROSA DEL AGUARAY,ASENT. KARAPA'I,RURAL,ASENT. KARAPA'I,4,106,E.E.B.,"DIRECCIÓN, SECRETARÍA, SALA DE PROFESORES, BIBL., AULAS, CERCADO",6,POZO ARTESIANO,ANDE,EN GESTIÓN,SI,LA INSTITUCIÓN NO CUENTA CON DICHOS REQUERIMIENTOS.,SAN PEDRO,2
103,_,,"ESC. BÁS. N° 232 ""PROF. MARCELINO MACHUCA MARTÍNEZ""",,LIMA,LIMA,URBANA,,7,80,E.E.B.,LABORATORIO,1,SENASA,ANDE,MEC,SI,DÉFICIT.,SAN PEDRO,2
3,_,,"LICEO NAC. ""PROSPERIDAD""",,SANTA ROSA DEL AGUARAY,PROSPERIDAD,RURAL,PROSPERIDAD,4,39,N.M.,AULAS,3,SENASA,ANDE,MEC,SI,NECESITAMOS CONSTRUCCIÓN DE AULA YA QUE EL NIVEL MEDIO NO CUENTA CON DICHA DEPENDENCIA.,SAN PEDRO,2
11,_,,COLEGIO  NAC.SAN ISIDRO,,GRAL. RESQUÍN,1ª LINEA,RURAL,KIRA Y,8,55,E.M ,AULAS,3,SENASA,ANDE,MEC,SI,NO TIENEN AULAS,SAN PEDRO,2
35,_,,LICEO KIRA Y,,GRAL. RESQUÍN,2ª LINEA ,RURAL,KIRA Y,8,70,E.M ,AULAS,3,SENASA,ANDE,IIDERT,SI,POR ATENTAR CONTRA LA VIDA DE ALUMNOS,SAN PEDRO,2
2,,,ESC.BÁS. Nº7357,,TACUATI,YVAMINDY,RURAL,YVAMINDY,1,42,E.E.B,AULAS,1,SI,SI,SI,SI,NUEVA CONSTRUCCIÓN,SAN PEDRO,2
62,,,ESC. BÁS. N° 1891 SAGRADO CORAZON DE JESUS,,CAPIIBARY,FINAP,RURAL,CALLE 20 DE JULIO,2,110,E.E.B,AULAS,3,SENASA,ANDE,MEC,SI,QUEREMOS 3 AULAS PARA EEB POR QUE HAY TODAVIA MAS BENEFICIARIOS ADEMAS ES UN CENTRO EDUCATIVO,SAN PEDRO,2
63,,,ESC. BÁS. N° 6195 VIRGEN DE FÁTIMA,,CAPIIBARY,B° VIRGEN DE FÁTIMA,URBANA,,2,126,E.E.B,AULAS,1,CORPOSANA,ANDE,MEC,SI,FALTA DE AULAS PARA EL PREESCOLAR Y PARTE ADMINISTRATIVA.,SAN PEDRO,2
64,,,ESC. BÁS. N° 6002 ARSENIO ERICO,,CAPIIBARY,A. 1° DE MARZO,RURAL,1° DE MARZO,2,70,E.E.B,AULAS,4,CORPOSANA,ANDE,MEC,SI,LAS AULAS ESTAN EN PÉSIMAS CONDICIONES Y SON DE MADERA,SAN PEDRO,2
151,,,ESC.NAC. DE COMERCIO,,ITAC.DEL ROSARIO ,SAN RAFAEL,URBANA,,6,44,E.M,AULAS,1,SI,SI,SI,SI,PARA MEJORAMIENTO DE INFRAESTRUCTURA,SAN PEDRO,2
153,,,COL. NAC. SAN ISIDRO DEL NORTE,,YRYBUCUA,SAN ISIDRO DEL NORTE,RURAL,SAN ISIDRO DEL NORTE,10,80,NM,AULAS,3,AGUA CORRIENTE,ANDE,SI,SI,NO CUENTA CON LOCAL PROPIO,SAN PEDRO,2
154,,,COL. NAC. YBU PORA,,YRYBUCUA,YBU PORA,RURAL,YBU PORA,10,76,NM,AULAS,3,AGUA CORRIENTE,ANDE,EN GESTION,SI,NO CUENTA CON LOCAL PROPIO,SAN PEDRO,2
156,,,COL. NAC. SAN NICOLAS,,YRYBUCUA,SAN NICOLAS,RURAL,YRYBUCUA,10,150,E.E.B Y E.M ,DIRECCIÓN,1,AGUA CORRIENTE,ANDE,SI,SI,NO CUENTA CON DIRECCIÓN,SAN PEDRO,2
157,,,COL. NAC. SAN NICOLAS,,YRYBUCUA,SAN NICOLAS,RURAL,YRYBUCUA,10,150,E.E.B Y E.M ,BIBLIOTECA,1,AGUA CORRIENTE,ANDE,SI,SI,NO CUENTA CON BIBLIOTECA,SAN PEDRO,2
158,,,COL. NAC. CRISTO REY,,YRYBUCUA,SAN ISIDRO DEL NORTE,RURAL,SAN ISIDRO DEL NORTE,10,72,E.E.B,AULAS,3,AGUA CORRIENTE,ANDE,EN GESTION,SI,NO CUENTA CON AULA PARA 3º CICLO,SAN PEDRO,2
159,,,COL. NAC. CRISTO REY,,YRYBUCUA,SAN ISIDRO DEL NORTE,RURAL,SAN ISIDRO DEL NORTE,10,72,E.E.B,LABORATORIO,1,AGUA CORRIENTE,ANDE,EN GESTION,SI,NO CUENTA CON AULA PARA LABORATORIO,SAN PEDRO,2
160,,,COL. NAC. CRISTO REY,,YRYBUCUA,SAN ISIDRO DEL NORTE,RURAL,SAN ISIDRO DEL NORTE,10,72,E.E.B,BIBLIOTECA,1,AGUA CORRIENTE,ANDE,EN GESTION,SI,NO CUENTA CON BIBLIOTECA,SAN PEDRO,2
161,,,COL. NAC. CRISTO REY,,YRYBUCUA,SAN ISIDRO DEL NORTE,RURAL,SAN ISIDRO DEL NORTE,10,72,E.E.B,DIRECCIÓN,1,AGUA CORRIENTE,ANDE,EN GESTION,SI,NO CUENTA CON DIRECCIÓN,SAN PEDRO,2
162,,,COL. NAC. CRISTO REY,,YRYBUCUA,SAN ISIDRO DEL NORTE,RURAL,SAN ISIDRO DEL NORTE,10,72,E.E.B,SECRETARÍA,1,AGUA CORRIENTE,ANDE,EN GESTION,SI,NO CUENTA CON SECRETARIA,SAN PEDRO,2
208,,,COL. NAC. YSAU,,YATAITY DEL NORTE,YSAU,RURAL,,8,89,N.M,AULAS,2,POZO ARTESIANO,ANDE,SI,SI,"LOS ALUMNOS TRABAJAN EN EL PATIO, PARA UN MEJOR
DESEMPEÑO",SAN PEDRO,2
211,,,COL. TÉC. DON MATILDO ADORNO,,YATAITY DEL NORTE,SAN JUAN,RURAL,,8,53,N.M,"AULAS
DIRECCIÓN
SECRETARIA
BIBLIOTÉCA
LABORATORIO",7,J. DE SANEAMIENTO,ANDE,SI,SI,"NO SE CUENTA NINGÚN AULA PEDAGÓGICA ADECUADA QUE FAVOREZCAN A LOS EDUCANDOS, PARA ACOGER DOCUMENTOS,PROVEER MATERIALES DIDÁCTICOS, REALIZAR EXPERIMENTOS ADECUADOS DE ACUERDO AL ÉNFASIS.",SAN PEDRO,2
212,,,"ESC. BÁS. Nº ""2502 DON JUAN E.O. L",,YATAITY DEL NORTE,SAN JUAN,RURAL,,8,240,E.E.B.,AULAS,3,SENASA,SI,SI,SI,PARA ALBERGAR A LOS ALUMNOS A UN ESPACIO ADECUADO .,SAN PEDRO,2
213,,,COL. NAC. 12 DE JUNIO,,YATAITY DEL NORTE,12 DE JUNIO,RURAL,,8,32,N.M,AULAS,3,POZO,ANDE,SI,SI,"ACTUALMENTE CUENTA CON AULA DE MADERA CONSTRUIDOS
POR LOS PADRES CON 10 AÑOS DE USO.",SAN PEDRO,2
214,,,ESC. BÁS. Nº  2875 SAN JOSÉ,,YATAITY DEL NORTE ,SAN JOSÉ,RURAL,,8,101,E.E.B.,AULAS,4,SI,SI,SI,SI,"ESTE PEDIDO OBEDECE A QUE LA INSTITUCIÓN
CUENTA CON AULA DE MADERA DETERIORADAS
DE 26 AÑOS DE USO.",SAN PEDRO,2
232,,,ESC. BÁS. Nº  1682 GUAVIRA POTY,,YATAITY DEL NORTE,GUAVIRA,RURAL,,8,60,E.E.B.,AULAS,2,SI,SI,SI,SI,PARA ALBERGAR A LOS ALUMNOS A UN ESPACIO ADECUADO .,SAN PEDRO,2
233,,,COL. NAC. GRAL. EDUVIGIS DÍAZ,,UNIÓN,SAN JORGE,RURAL,,8,36,N.M,AULAS,3,POZO,ANDE,SI,SI,"LA INSTITUCIÓN DEL COLEGIO FUNCIONA EN EL PREDIO DE 
LA ESCUELA, NECESITAMOS UN LUGAR EXCLUSIVO PARA 
EL NIVEL MEDIO",SAN PEDRO,2
234,,,COL. NAC. NIÑO SALVADOR,,YATAITY DEL NORTE,GUAVIRA,RURAL,,8,101,N.M,AULAS,3,CORPOSANA,ANDE,SI,SI,"PARA ALBERGAR A MÁS ALUMNOS QUE PERTENECEN A LA 
ESPECIALIDAD IPA.",SAN PEDRO,2
235,,,COL. NAC. SANTA LUCIA,,YATAITY DEL NORTE,MARÍA AUXILIADORA,RURAL,,8,20,,AULAS,2,BOMBA DE AGUA,ANDE,SI,SI,"LA INSTITUCIÓN CUENTA CON  AULAS MUY PRECARIAS DON-
DE HACE MUCHA FALTA LA CONSTRUCCIÓN DE SALAS NUEVAS.",SAN PEDRO,2
236,,,COL. NAC. NUEVA ALIANZA,,YATAITY DEL NORTE,NUEVA ALIANZA,RURAL,,8,45,E.E.B. Y N M.,"AULAS
DIRECCIÓN",2,POZO,ANDE,SI,SI,"LOS ALUMNOS DAN CLASES BAJO LOS ÁRBOLES POR NO CONTAR CON AULAS, HACE FALTA UN ESPACIO DESTINADO
PARA LA DIRECCIÓN.",SAN PEDRO,2
237,,,COL. NAC. MARÍA AUXLIADORA,,YATAITY DEL NORTE,MARÍA AUXILIADORA,RURAL,,8,45,E.M ,AULAS,4,SENASA,ANDE,SI,SI,"EL COLEGIO ESTÁ FUNCIONANADO EN EL LOCAL DE LAESC. BÁS. 627, NO CUNETA CON LOCAL PROPIO",SAN PEDRO,2
238,,,ESC BÁS S/N,,CAPIIBARY,JAVIER KUE,RURAL,JAVIER KUE,1,37,E.E.B,AULAS,1,NO,NO,GESTIÓN,SI,NUEVA CONSTRUCCIÓN,SAN PEDRO,2
239,,,ESC BÁS S/N,,CAPIIBARY,KA'AGUY PYAHU,RURAL,KA'AGUY PYAHU,1,13,E.E.B,AULAS,1,NO,SÍ,SÍ ,SI,NUEVA CONSTRUCCIÓN,SAN PEDRO,2
240,,,ESC BÁS S/N,,YRYBUCUA,MBURUKUJA,RURAL,MBURUKUJA,1,30,E.E.B,AULAS,1,SÍ,SÍ,SÍ ,SI,NUEVA CONSTRUCCIÓN,SAN PEDRO,2
241,,,ESC BÁS S/N,,GUAJAYVI,KUPA'Y,RURAL,KUPA'Y,1,20,E.E.B,AULAS,1,NO,NO,SÍ ,SI,NUEVA CONSTRUCCIÓN,SAN PEDRO,2
243,,,ESCUELA BÁSICA S / N,,"KAPI,IBARY",JAVIERGUE RUGUA,RURAL,JAVIERGUE RUGUA,1,37,E.E.B,,1,,,,SI,APERTURA,SAN PEDRO,2
244,,,ESCUELA BÁSICA S / N,,"KAPI,IBARY",KA.AGUY PYAHU,RURAL,"KA,AGUY PYAHU",1,13,E.E.B,,1,,,,,APERTURA,SAN PEDRO,2
245,,,ESCUELA BÁSICA S / N,,YRYBUCUA,MBURUKUJA,RURAL,MBURUKUJA,1,30,E.E.B,,1,SI,SI,,SI,APERTURA,SAN PEDRO,2
246,,,ESCUELA BÁSICA S / N,,GUAJAYVI,"KUPA,Y",RURAL,"KUPA,Y",1,20,E.E.B,,1,,,,SI,APERTURA,SAN PEDRO,2
2,,,ESC. BÁS. N° 44 CAP. PEDRO JUAN CABALLERO,,TOBATÍ ,VIRGEN DE FÁTIMA,URBANA,,2,120,"E.I, 1°, 2°  CICLO E.E.B",AULAS,2,ESSAP,ANDE,MEC,SI,NECESITA AULA PARA EL PREESCOLAR ,CORDILLERA,3
3,,,"ESC. B. N° 7423 "" SANTA TERESITA.""",,CAACUPÉ,SAN BLAS,URBANA,,3,310,E.I Y E.E.B.,AULAS,3,ESSAP,ANDE,MEC,SI,CRECIMIENTO POBLACIONAL,CORDILLERA,3
5,,,COLEGIO NACIONAL RAMÓN INDALECIO CARDOZO,,SAN BERNARDINO,YBU,RURAL,,1,75,MEDIO,,1,SÍ,SÍ,SÍ,SI,"CONSTRUCCIÓN DE AULA PARA EL 3ER AÑO, CRECIMIENTO NATURAL",CORDILLERA,3
6,,,ESC. BÁS. N° 1757 SANTA ELENA,,TOBATÍ ,POTRERO,RURAL,,2,250,"E.I, 1°, 2°  CICLO E.E.B",PISTA ,1,ESSAP,ANDE,MEC,SI,PARA PACTICAR DEPORTES Y RECREACIÓN DE LOS ALUMNOS,CORDILLERA,3
7,,,"ESC. B N° 6914 "" SANTA ANA""",,CAACUPÉ,LOMA GUAZÚ,URBANA,,3,152,E.I Y E.E.B.,AULAS,2,J. DE SANEAMIENTO,ANDE,MEC,SI,CRECIMIENTO POBLACIONAL,CORDILLERA,3
9,,,COLEGIO NACIONAL DEFENSORES DEL CHACO,,ATYRA,CAACUPEMI,RURAL,,1,60,MEDIO,AULAS,2,SÍ,SÍ,SÍ,SI,ALUMNOS DANDO CLASES EN EL PATIO,CORDILLERA,3
10,,,COL. NAC. CAP. PEDRO JUAN CABALLERO,,TOBATÍ ,VIRGEN DE FÁTIMA,URBANA,,2,560,3° CICLO E.E.B,AULAS,3,ESSAP,ANDE,MEC,SI,POR CREACIÓN DEL 3º CICLO.,CORDILLERA,3
11,,,"ESC. B. N° 609 "" GRAL. DE B.ELIGIO T.""",,CAACUPÉ,ALMADA,RURAL,,3,359,E.I Y E.E.B.,AULAS,2,J. DE SANEAMIENTO,ANDE,MEC,SI,CRECIMIENTO POBLACIONAL,CORDILLERA,3
71,,,ESC.2252 GRAL RAIMUNDO ROLÓN,,ITAC.DELACORD.,CÑIA.JAGUARETECUA,RURAL,,3,94,E.E.B1º Y 2ºC,DEPÓSITO,1,SENASA,ANDE,MEC,SI,ESPACIO PARA ALVERGAR MATERIALES,CORDILLERA,3
14,,,ESC. BÁS. N° 650 TTE. ROJAS SILVA,,1° DE MARZO,TTE. ROJAS SILVA,RURAL,,2,115,"E.I, 1°, 2°  CICLO E.E.B","COCINA,COMEDOR ",1,ESSAP,ANDE,MEC,SI,PARA OFRECER UN SERVICIO MÁS CONFORTABLE E HIGIÉNICO ,CORDILLERA,3
15,,,"ESC. B. N° 3680 "" SAN MIGUEL A.""",,CAACUPÉ,SAN MIGUEL,URBANA,,3,360,E.I Y E.E.B.,AULAS,2,ESSAP,ANDE,MEC,SI,CRECIMIENTO POBLACIONAL,CORDILLERA,3
16,,,C.N. REGINA MARECOS,,JUAN DE MENA,ASENTAMIENTO,RURAL,REGINA MARECOS,4,55,E.M ,"DIRECCIÓN SALA DE PROF, BIBLIOT",1,CORRIENTE,ANDE,MEC,SI,PARA MEJORAR LA CALIDAD EDUCATIVA,CORDILLERA,3
17,,,COLEGIO NACIONAL EMD FRANCISCO S.LÓPEZ,,ATYRA,CENTRO,URBANA,,1,180,MEDIO,AULAS,3,SÍ,SÍ,SÍ,SI,BLOQUE PARA AULAS INCONCLUSA QUE NO PUEDE UTILIZARSE,CORDILLERA,3
18,,,ESC. BÁS. N° 650 TTE. ROJAS SILVA,,1° DE MARZO,TTE. ROJAS SILVA,RURAL,,2,115,"E.I, 1°, 2°  CICLO E.E.B",CERCADO,1,ESSAP,ANDE,MEC,SI,SALVAGUARDAR LA POBLACIÓN ESCOLAR Y EL EDIFICIO ,CORDILLERA,3
19,,,"ESC. B. N° 5081 "" MOISÉS S. BERT.""",,CAACUPÉ,POTRERO PO'I,RURAL,,3,120,E.I Y E.E.B.,AULAS,2,J. DE SANEAMIENTO,ANDE,MEC,SI,CRECIMIENTO POBLACIONAL,CORDILLERA,3
22,,,ESC. BÁS. N° 3906 THELMA S. DE CABRIZA,,TOBATÍ ,MOMPOX,RURAL,,2,170,E.I. E.E.B,COCINA,1,ESSAP,ANDE,MEC,SI,IMPLEMENTACIÓN DEL ALMUERZO ESCOLAR.,CORDILLERA,3
23,,,"ESC. B.N° 485 "" DANIEL ORTELLADO""",,CAACUPÉ,CERRO REAL,RURAL,,3,460,E.I Y E.E.B.,SECRETARÍA,1,POZO ARTEC.,ANDE,MEC,SI,OFRECER MEJOR SERVICIO A LA INSTITUCIÓN.,CORDILLERA,3
25,,,COLEGIO NACIONAL PROF. ELVIRA R. DE BALBUENA,,SAN BERNARDINO,CIERVO CUA,RURAL,,1,100,MEDIO,AULAS,1,SI,SI,SI,SI,"TRES AULAS PARA GRUPOS QUE DAN CLASES EN UN ESPACIO COMPARIDO CON LA DIRECCIÓN , SECRETARÍA Y BIBLIOTECA",CORDILLERA,3
26,,,ESC. BÁS. N° 491 MARIA AUXILIADORA ,,TOBATÍ ,VIRGEN DE FÁTIMA,URBANA,,2,480,"E.I, 1°, 2°  Y 3° CICLO E.E.B",DIRECCIÓN,1,ESSAP,ANDE,MEC,SI,LA DIRECCIÓN FUNCIONA EN LA BIBILOTECA ,CORDILLERA,3
27,,,"ESC. B.N° 485 "" DANIEL ORTELLADO""",,CAACUPÉ,CERRO REAL,RURAL,,3,460,E.I Y E.E.B.,SALA DE PROFESORES,1,POZO ARTEC.,ANDE,MEC,SI,OFRECER MEJOR SERVICIO A LA INSTITUCIÓN.,CORDILLERA,3
28,,,C. N SAGRADA FAMILIA,,JUAN DE MENA,ASENTAMIENTO,RURAL,GUIDO ALMADA II,4,40,E.M ,AULAS DIRECCIÓN,3,CORRIENTE,NO TIENE,MEC,SI,PARA MEJORAR LA CALIDAD EDUCATIVA,CORDILLERA,3
30,,,ESC. BÁS. N° 2243 SGTO. I. BÁEZ,,1° DE MARZO,SGTO. BÁEZ,RURAL,,2,100,"E.I, 1°, 2°  Y 3° CICLO E.E.B",AULAS,1,ESSAP,ANDE,MEC,SI,CRESIMIENTO NATURAL ,CORDILLERA,3
31,,,"ESC. B.N° 485 "" DANIEL ORTELLADO""",,CAACUPÉ,CERRO REAL,RURAL,,3,460,E.I Y E.E.B.,LABORATORIO,1,POZO ARTEC.,ANDE,MEC,SI,OFRECER MEJOR SERVICIO A LA INSTITUCIÓN.,CORDILLERA,3
33,,,COLEGIO TÉCNICO SAN BERNARDINO,,SAN BERNARDINO,__,RURAL,,1,175,MEDIO,,1,SÍ,SÍ,SÍ,SI,CONSTRUCCIÓN DE TALLER GASTRONÓMICO,CORDILLERA,3
34,,,ESC. BÁS. N° 2243 SGTO. I. BÁEZ,,1° DE MARZO,SGTO. BÁEZ,RURAL,,2,100,"E.I, 1°, 2°  Y 3° CICLO E.E.B","COCINA,COMEDOR ",2,ESSAP,ANDE,MEC,SI,PARA OFRECER UN SERVICIO MÁS CONFORTABLE E HIGIÉNICO ,CORDILLERA,3
35,,,ESC.47 PROF. PEDRO AGUILERA,,ITAC.DELACORD.,Bº SAN ANTONIO,URBANA,,3,351,E.E.B ,COCINA/COMEDOR,1,SENASA,ANDE,MEC,SI,CONTAR CON ESPACIO ADECUADO PARA LA ,CORDILLERA,3
38,,,ESC. BÁS. N° 2243 SGTO. I. BÁEZ,,1° DE MARZO,SGTO. BÁEZ,RURAL,,2,100,"E.I, 1°, 2°  Y 3° CICLO E.E.B",CERCADO,3,ESSAP,ANDE,MEC,SI,SALVAGUARDAR LA POBLACIÓN ESCOLAR Y EL EDIFICIO ,CORDILLERA,3
39,,,ESC.103 PROF.MERCEDES MILTOS DE I.R,,ITAC.DELA CORD.,Bº SAN JOSÉ,URBANA,,3,250,E.E.B,AULAS,2,SENASA,ANDE,MEC,SI,PARA ALBERGAR ADO GRADOS DE LA DE / IPA,CORDILLERA,3
41,,,COLEGIO NACIONAL DON OCTAVIANO RIVAROLA,,ARROYOS Y ESTEROS,,RURAL,,1,,MEDIO,AULAS,1,SÍ,SÍ,SÍ,SI,CONSTRUCCION DE AULAS PARA DOS CURSOS QUE DAN CLASES EN EL PATIO,CORDILLERA,3
42,,,ESC. BÁS. N° 2243 SGTO. I. BÁEZ,,1° DE MARZO,SGTO. BÁEZ,RURAL,,2,100,IPA,GALLINERO ,1,ESSAP,ANDE,MEC,SI,NECESITA PARA IMPLEMENTAR IPA,CORDILLERA,3
43,,,ESC. 4070 PARROQ. SUBV. SAN BLAS,,ITAC.DELA CORD.,CÑIA PIRAYUI,RURAL,,3,61,E INICIAL,AULAS,1,SENASA,ANDE,OBISPADO,SI,AULA ACORDE A LOS NIÑOS DEL PE Y JARDÍN,CORDILLERA,3
46,,,ESC. BÁS. N° 2245 ANDREA R. RITZ,,1° DE MARZO,CAACGUY CUPE,RURAL,,2,38,"E.I, 1°, 2°  Y 3° CICLO E.E.B",AULAS,1,ESSAP,ANDE,MEC,SI,CRECIMIENTO NATURAL,CORDILLERA,3
47,,,ESC.103 PROF.MERCEDES MILTOS DE I.R,,ITAC.DELA CORD.,Bº SAN JOSÉ,URBANA,,3,250,E.E.B,COCINA/COMEDOR,1,SENASA,ANDE,MEC,SI,CONTAR CON ESPACIO ADECUADO PARA LA ,CORDILLERA,3
48,,,C.N. SANTO DOMINGO DE GUZMÁN,,JUAN DE MENA,CÑÍA SANTO DOMINGO,RURAL,,4,60,E. MEDIA,"DIRECCIÓN BIBLIOT, LABORAT",3,_,NO TIENE,MEC,SI,PARA MEJORAR LA CALIDAD EDUCATIVA,CORDILLERA,3
49,,,ESC.BÁS.N° 490 PETRONITA ESPINOLA ,,ARROYOS Y ESTEROS,CAÑADA DOMINGUEZ,RURAL,,1,70,E.E.B,HA,1,SENASA,ANDE,MEC,SI,PARA EL TERCER CICLO,CORDILLERA,3
50,,,ESC. BÁS. N° 2244 VIRGEN INMACULADA  CONCEPCION ,,1° DE MARZO,POTRERITO,RURAL,,2,15, 3° CICLO E.E.B,AULAS,1,ESSAP,ANDE,MEC,SI,CRECIMIENTO NATURAL,CORDILLERA,3
51,,,ESC. 713 MANUEL DE LOS SANTOS AGUILERA,,ITAC.DELA CORD.,CÑIA RUBIO ÑU,RURAL,,3,46,E.E.B 1ºY2ºC,AULAS,1,COMUNIDAD,ANDE,MEC,SI,"COMPARTEN EN UNA SALA UN GRADO, DIRECC Y SALA DE INFORMÁTICA.",CORDILLERA,3
53,,,COLEGIO NACIONAL PADRE ANGEL ROSA CARDENAS,,ARROYOS Y ESTEROS,ITACUA,RURAL,,1,100,MEDIO,,1,SÍ,SÍ,SÍ,SI,CONSTRUCCIÓN DE AULA,CORDILLERA,3
54,,,ESC. BÁS. N° 2244 VIRGEN INMACULADA  CONCEPCION ,,1° DE MARZO,POTRERITO,RURAL,,2,15, 3° CICLO E.E.B,"COCINA,COMEDOR ",2,ESSAP,ANDE,MEC,SI,PARA OFRECER UN SERVICIO MÁS CONFORTABLE E HIGIÉNICO ,CORDILLERA,3
55,,,ESC.2251 PARROQ.SUBV. SANTA LUCIA,,ITAC.DELA CORD.,Bº SANTA LUCIA,URBANA,,3,210,E.E.B1ºY2ºC,AULA/G APOYO,1,SENASA,ANDE,OBISPADO,SI,OFRECER UN ESPACIO ADECUADO PARA LOS ALUMNOS QUE ASISTEN AL GRADO DE APOYO,CORDILLERA,3
56,,,C.N. PROF. JUAN DE LA CRUZ ANTÚNEZ,,JUAN DE MENA,CÑÍA 8 DE DICIEMBRE,RURAL,,4,54,EDUC. MEDIA,"AULAS DIREC, BIBLIOT, LABORAT",4,POZO ,ANDE,MEC,SI,PARA MEJORAR LA CALIDAD EDUCATIVA,CORDILLERA,3
58,,,ESC. BÁS. N° 2240 MCAL. J. F. ESTIGARRIBIA ,,1° DE MARZO,MCAL. J.F.E.,RURAL,,2,157,"E.I, 1°, 2°  Y 3° CICLO E.E.B",AULAS,2,ESSAP,ANDE,MEC,SI,REUBICACIÓN DEL 7° GRADO QUE FUNCIONA EN LA DIRECCIÓN Y PARA DEPOSITO ,CORDILLERA,3
59,,,ESC.47 PROF. PEDRO AGUILERA,,ITAC.DELACORD.,Bº SAN ANTONIO,URBANA,,3,351,E.E.B1ºAL 9ºG,SALA DE PROFESORES,1,SENASA,ANDE,MEC,SI,ESPACIO ADECUADO PARA DOCENTES,CORDILLERA,3
63,,,ESC.393 PROF.FELICIANA ACOSTA DE A.,,ITAC.DELACORD.,CÑIA.POTRERO A.,RURAL,,3,178,E.E.B1ºAL 3ºC,S.P/ INFORMÁTICA,1,SENASA,ANDE,MEC,SI,ENSEÑANZA DE INFORMÁTICA,CORDILLERA,3
65,,,COLEGIO NACIONAL PROF. LUISA G. DE BENÍTEZ,,ARROYOS Y ESTEROS,URUNDEY,RURAL,,1,200,MEDIO,,1,SÍ,SÍ,SÍ,SI,CONSTRUCCIÓN DE AULA PARA BTA,CORDILLERA,3
67,,,ESC.2252 GRAL RAIMUNDO ROLÓN,,ITAC.DELACORD.,CÑIA.JAGUARETECUA,RURAL,,3,94,E.E.B1º Y 2ºC,SALA DE PROFESORES,1,TANQUE P.,ANDE,MEC,SI,ESPACIO ADECUADO PARA DOCENTES,CORDILLERA,3
72,,,C.N. SAN RAFAEL ARCÁNGEL,,JUAN DE MENA,CENTRO,URBANA,,4,127,E.E.B Y E.M ,"SALA DE PROF,LABORATOR",2,CORRIENTE,ANDE,PRIVADO,SI,PARA MEJORAR LA CALIDAD EDUCATIVA,CORDILLERA,3
73,,,ESC.BÁS.5097 MARÍA RITA FIGARI DE POLETTI,,ARROYOS Y ESTEROS,JUGUA'I,RURAL,,1,100,E.E.B,DIRECCIÓN,1,J. DE SANEAMIENTO,ANDE,MEC,SI,NO SE CUENTA CON SALA PARA DIRECCIÓN ,CORDILLERA,3
74,,,ESC. BÁS. N° 2240 MCAL. J. F. ESTIGARRIBIA ,,1° DE MARZO,MCAL. J.F.E.,RURAL,,2,123,"E.I, 1°, 2°  Y 3° CICLO E.E.B","COCINA,COMEDOR ",1,ESSAP,ANDE,MEC,SI,PARA OFRECER UN SERVICIO MÁS CONFORTABLE E HIGIÉNICO ,CORDILLERA,3
75,,,ESC.713MANUEL DE LOS SANTOS A.,,ITAC.DELA CORD.,CÑIA.RUBIO ÑU,RURAL,,3,46,E.E.B1ºY2º C,S.P/ INFORMÁTICA,1,COMUNIDAD,ANDE,MEC,SI,ENSEÑANZA DE INFORMÁTICA,CORDILLERA,3
76,,,CENTRO 3-79 JÓVENES Y ADULTOS,,JUAN DE MENA,CENTRO,RURAL,,4,39,EDUC PERMANENTE,AULAS,3,POZO ,ANDE,MEC,SI,PARA MEJORAR LA CALIDAD EDUCATIVA,CORDILLERA,3
78,,,ESC. BÁS. N° 7485 SAN MIGUEL ARCÁNGEL,,1° DE MARZO,BOQUERÓN,RURAL,,2,15,EDUC. INICIAL,AULAS,2,ESSAP,ANDE,MEC,SI,UN LUGAR APROPIADO PARA EL NIVEL Y DEPOSITO ,CORDILLERA,3
79,,,ESC.713MANUEL DE LOS SANTOS A.,,ITAC.DELA CORD.,CÑIA.RUBIO ÑU,RURAL,,3,46,E.E.B1ºY2º C,DIRECCIÓN,1,COMUNIDAD,ANDE,MEC,SI,"ESPACIO ADECUADO PARA LA ATENCIÓN, ETC.",CORDILLERA,3
81,,,ESC. BÁS. N° 692 DEF. DEL CHACO,,TOBATÍ ,21 DE JULIO,RURAL,COL. 21 DE JULIO,2,414,"E.I, 1°, 2°  CICLO E.E.B",AULAS,1,ESSAP,ANDE,MEC,SI,PARA E.I. Y 1° GRADO,CORDILLERA,3
82,,,ESC.103 PROF.MERCEDES MILTOS DE IR,,ITAC.DELA CORD.,Bº SAN JOSÉ,URBANA,,3,250,E.E.B1º AL 9º G,DIRECCIÓN,1,SENASA,ANDE,MEC,SI,ESPACIO PARA ATENCIÓN ADECUADA A LA CE,CORDILLERA,3
84,,,ESC. BÁS. N° 7485 SAN MIGUEL ARCÁNGEL,,1° DE MARZO,BOQUERÓN,RURAL,,2,10,EDUC. INICIAL,AULAS,1,ESSAP,ANDE,MEC,SI,SALVAGUARDAR LA POBLACIÓN ESCOLAR Y EL EDIFICIO ,CORDILLERA,3
85,,,ESC.47 PROF. PEDRO AGUILERA,,ITAC.DELA CORD.,Bº SAN ANTONIO,URBANA,,3,351,E.E.B 1º AL 9º G,LABORATORIO,1,SENASA,ANDE,MEC,SI,ESPACIO PARA APRENDER EN FORMA PRÁCTICA,CORDILLERA,3
88,,,ESC.2252 GRAL.RAIMUNDO ROLÓN,,ITAC.DELA CORD.,CÑIA.JAGURETE CUA,RURAL,,3,93,E.E.B 1º AL 6º G,LABORATORIO,1,TANQUE P.,ANDE,MEC,SI,ESPACIO PARA APRENDER EN FORMA PRÁCTICA,CORDILLERA,3
90,,,ESC. BÁS. N° 7485 SAN MIGUEL ARCÁNGEL,,1° DE MARZO,BOQUERÓN,RURAL,,2,10,EDUC. INICIAL,"COCINA,COMEDOR ",1,ESSAP,ANDE,MEC,SI,PARA OFRECER UN SERVICIO MÁS CONFORTABLE E HIGIÉNICO ,CORDILLERA,3
91,,,ESC.2252 GRAL.RAIMUNDO ROLÓN,,ITAC.DELA CORD.,CÑIA.JAGURETE CUA,RURAL,,3,93,E.E.B 1º AL 6º G,TINGLADO,1,TANQUE P.,ANDE,MEC,SI,ESPACIO PARA RECREACIÓN Y USO DE LA CE,CORDILLERA,3
93,,,ESC. BÁS. N° 7485 SAN MIGUEL ARCÁNGEL,,1° DE MARZO,BOQUERÓN,RURAL,,2,10,EDUC. INICIAL,CASETA ,1,ESSAP,ANDE,MEC,SI,PARA CANTINA ESCOLAR ,CORDILLERA,3
94,,,ESC. BÁS. N° 1086 P.P.S.SAN JOSÉ,,VALENZUELA,B° SAN JOSÉ,URBANA,,3,150,"E.E.B 1°,2° Y 3° ",AULAS,1,CORPOSANA,ANDE,OBISPADO,SI,UTILIZAN UNA SALA DE 3M X 3M,CORDILLERA,3
