569,0,,ESC. BÁS. N° 7573  VIRGEN DE CAACUPÉ DE FE Y ALEGRIA ,,LUQUE,HERNANDARIAS,URBANA,,R2,30,E.E.B,AULAS,1,OTRO,ANDE,MEC,SI,SE NECESITAN AULAS PARA EL 3ER.CICLO,CENTRAL,11
571,0,,ESC. BÁS. N° 7573  VIRGEN DE CAACUPÉ DE FE Y ALEGRIA ,,LUQUE,HERNANDARIAS,URBANA,,R2,25,E.E.B,AULAS,1,OTRO,ANDE,MEC,SI,NIVEL INICIAL NO CUENTA CON AULA,CENTRAL,11
573,0,,ESC. BÁS. N° 7573  VIRGEN DE CAACUPÉ DE FE Y ALEGRIA ,,LUQUE,HERNANDARIAS,URBANA,,R2,250,E.E.B,BIBLIOTECA,1,OTRO,ANDE,MEC,SI,NECESIDAD DE ESTE ESPACIO DE LECTURA,CENTRAL,11
216,1114009,,COLEGIO NACIONAL  JOSÉ DOLORES GONZÁLEZ ,,SAN LORENZO,TAYUAZAPE,URBANA,,R1,131,MEDIO,SALA DE INFORMÁTICA,1,AGUATERIA,ANDE,MEC,SI,POR NO CONTAR CON SALA DE INFORMATICA MUY NECESARIO PARA EL BTC,CENTRAL,11
218,1114009,,COLEGIO NACIONAL  JOSÉ DOLORES GONZÁLEZ ,,SAN LORENZO,TAYUAZAPE,URBANA,,R1,200,MEDIO,SALÓN MULTIUSO,1,AGUATERIA,ANDE,MEC,SI,"POR NO CONTAR CON UN ESPACIO PARA LA REALIZACION DE ACTIVIDADES ACADEMICAS CON ALUMNOS, DOCENTES Y PADRES",CENTRAL,11
220,1114009,,COLEGIO NACIONAL  JOSÉ DOLORES GONZÁLEZ ,,SAN LORENZO,TAYUAZAPE,URBANA,,R1,131,MEDIO,AULASS,3,AGUATERIA,ANDE,MEC,SI,CONSTRUCCION DE SALAS EQUIPADAS PARA LOS ALUMNOS DEL BTC EN HORARIO OPUESTO,CENTRAL,11
260,1114036,,"CENTRO REGIONAL  ""SATURIO RÍOS""",,SAN LORENZO,SAN ANTONIO,URBANA,,R1,1050,MEDIO,AULASS,6,AGUATERIA,ANDE,MEC,SI,EL PEDIDO OBEDECE A LA SEPARACION DEL BACHILLERATO TECNICO CIENTIFICO,CENTRAL,11
262,1114036,,"CENTRO REGIONAL  ""SATURIO RÍOS""",,SAN LORENZO,SAN ANTONIO,URBANA,,R1,1050,MEDIO,AULASS,2,AGUATERIA,ANDE,MEC,SI,SEPARACION ADMINISTRATIVA DE DIRECCION Y SECRETARIA,CENTRAL,11
108,7560,44,ESC. BÁS. N° 15309 SAN JOSÉ ,,AREGUÁ,ISLA VALLE,URBANA,,R3,30,N1,AULAS,1,AGUATERIA,ANDE,MEC,SI,CRECIMIENTO NATURAL,CENTRAL,11
255,7560,44,ESC. BÁS. N° 15309 SAN JOSÉ ,,AREGUÁ,ISLA VALLE,URBANA,,R3,120,N1,BIBLIOTECA,1,AGUATERIA,ANDE,MEC,SI,FALTA DE INFRAESTRUCTURA,CENTRAL,11
289,7560,44,ESC. BÁS. N° 15309 SAN JOSÉ ,,AREGUÁ,ISLA VALLE,URBANA,,R3,150,N1,DIRECCIÓN,1,AGUATERIA,ANDE,MEC,SI,FALTA DE INFRAESTRUCTURA,CENTRAL,11
349,7560,44,ESC. BÁS. N° 15309 SAN JOSÉ ,,AREGUÁ,ISLA VALLE,URBANA,,R3,150,N1,MURALLA,,AGUATERIA,ANDE,MEC,SI,POR LA EXTREMA INSEGURIDAD,CENTRAL,11
179,103090,1012,ESC.BAS.Nº 1782,1782,AZOTEY,Bº SANTA ANA,RURAL,,6,-,COMPARTIDO,AULAS,1,J. DE SANEAMIENTO,ANDE,MEC,SI,PARA ALBERGAR A MAS ALUMNOS,CONCEPCION,1
39,,1062,ESC. BÁS. N 985 PROF. JUANA FERNÁNDEZ DE ALONSO,,CONCEPCIÓN ,PASO HORQUETA,RURAL,,2,20,E.E.B,AULAS,1,RIO,ANDE ,MEC,SI,DÉFICIT DE SALA PARA P. ESCOLAR,CONCEPCION,1
40,,1062,ESC. BÁS. N 985 PROF. JUANA FERNÁNDEZ DE ALONSO,,CONCEPCIÓN ,PASO HORQUETA,RURAL,,2,218,E.E.B Y N. M,POZO ARTESIANO,1,RIO,ANDE ,MEC,SI,PORQUE EL AGUA CORRIENTE DEL RIO NO ESTÁ TRATADA,CONCEPCION,1
41,,1062,ESC. BÁS. N 985 PROF. JUANA FERNÁNDEZ DE ALONSO,,CONCEPCIÓN ,PASO HORQUETA,RURAL,,2,218,E.E.B Y N. M,POZO ARTESIANO,1,RIO,ANDE ,MEC,SI,,CONCEPCION,1
79,208238,1249,COL. NACIONAL TTE. CNEL. FULGENCIO YEGROS,,SAN ESTANISLAO,CALLE 12000 DEF. DEL CHACO,RURAL,COL. DEF. DEL CHACO,4,30,E.E.B.,AULAS,2,SI,SI,SI,SI,"REPARACIÓN DE PARED, PISO, PUERTAS Y VENTANAS",SAN PEDRO,2
69,204026,1475,COL. NAC. TTE. ADOLFO ROJAS SILVA,,GEA,JHUGUA REY,RURAL,,11,212,COMPARTIDO,AULAS,3,POZO,SI,SI,SI,DEFICIT,SAN PEDRO,2
144,208002,1682,ESC. BÁS. 2742 NAZARETH,,SAN ESTANISLAO,MONTE ALTO,URBANA,MONTE ALTO,4,285,EI Y E.E.B,"SALÓN MULTIUSO, AULUASPARA ARTES INDUSTRIALES, AULAS PARA GRADOS",4,SÍ,SI,SI,SI,DEFICIT,SAN PEDRO,2
72,208003,1683,"ESCUELA BÁSICA N°2846 ""VIRGEN DE LOURDES""",,SAN ESTANISLAO,BO VIRGEN DE LOURDES,URBANA,,4,209,"E.I., E.E.B. Y NIVEL MEDIO",AULAS,7,SI,SI,SI,SI,DÉFICIT,SAN PEDRO,2
86,208004,1684,"ESCUELA BÁSICA N°1874 ""CNEL. VICENTE MONGELÓS""",,SAN ESTANISLAO,BO CNEL. VICENTE MONGELÓS,URBANA,,4,27,E.I.,AULAS,1,SI,SI,SI,SI,DÉFICIT,SAN PEDRO,2
145,208005,1685,ESC. BÁS. N° 4977 SAN ROQUE G. DE SANTACRUZ,,SAN ESTANISLAO,YCUA PA'I,URBANA,YCUA PA'I,4,64,E.E.B,AULAS,1,SÍ,SI,SI,SI,DEFICIT,SAN PEDRO,2
139,208007,1687,ESC. BÁS. N° 4413 MARIA AUXILIADORA,,SAN ESTANISLAO,B° 3 TAPIRACUAI,URBANA,B° 3 TAPIRACUAI,4,338,"EI, E.E.B Y E.M ","SALA DE CLASE, BIBLIOTECA, LABORATORIO, TALLER,DIRECCIÓN",6,SÍ,SI,SI,SI,DEFICIT,SAN PEDRO,2
140,208010,1690,ESC. BÁS N° 4414 MADRE MARIA BENITA ARIAS,,SAN ESTANISLAO,B° SAN JOSÉ,URBANA,B° SAN JOSÉ,4,77,EI Y E.E.B,AULAS,2,SÍ,SI,SI,SI,DEFICIT,SAN PEDRO,2
75,208011,1691,COL. NAC. E.M.D. SEBASTIAN DE YEGOS,,SAN ESTANISLAO,CIRATY,URBANA,,4,210,"E.E.B , BT Y BC",AULAS,9,SÍ,SI,SI,SI,DEFICIT,SAN PEDRO,2
76,208011,1691,,,SAN ESTANISLAO,CIRATY,URBANA,,4,750,"E.E.B , E.M  Y FP","LABORATORIO DE INFORMÁTICA,POLIDEPORTIVO",2,SÍ,SI,SI,SI,DEFICIT,SAN PEDRO,2
146,208013,1693,ESC. BÁS. N° 3772 VIRGEN DE FÁTIMA,,SAN ESTANISLAO,VIRGEN DE FÁTIMA,URBANA,VIRGEN DE FÁTIMA,4,78,E.E.B,AULAS,2,SÍ,SI,SI,SI,DEFICIT,SAN PEDRO,2
102,208049,1729,COLEGIO TÉCNICO AGROPECUARIO SAN SEBASTIÁN,,SAN ESTANISLAO,BO 20 DE ENERO,RURAL,,4,108,E.E.B. Y NIVEL MEDIO,LABORATORIO,2,SI,SI,SI,SI,DÉFICIT,SAN PEDRO,2
82,208075,1755,"ESC. BÁS. N° 3069 ""VIRGEN DE FÁTIMA""",,SAN ESTANISLAO,YATAITY CORÁ,RURAL,,4,10,E.I.,AULAS,1,SI,SI,SI,SI,DÉFICIT,SAN PEDRO,2
83,208075,1755,"ESC. BÁS. N° 3069 ""VIRGEN DE FÁTIMA""",,SAN ESTANISLAO,YATAITY CORÁ,RURAL,,4,60,E.I. Y E.E.B.,BIBLIOTECA,1,SI,SI,SI,SI,DÉFICIT,SAN PEDRO,2
84,208075,1755,"ESC. BÁS. N° 3069 ""VIRGEN DE FÁTIMA""",,SAN ESTANISLAO,YATAITY CORÁ,RURAL,,4,5,E.I. Y E.E.B.,SALA DE PROFESORES,1,SI,SI,SI,SI,DÉFICIT,SAN PEDRO,2
142,208076,1756,ESC. BÁS. N° 2753 SAN JOSÉ,,SAN ESTANISLAO,ARROYO GUAZÚ,RURAL,ARROYO GUAZÚ,4,70,EI ,AULAS,1,SÍ,SI,SI,SI,DEFICIT,SAN PEDRO,2
77,208083,1763,COL. NACIONAL DOMINGO SAVIO,,SAN ESTANISLAO,BO SAN BLÁS,RURAL,COL. DEF. DEL CHACO,4,95, NIVEL MEDIO,AULAS,3,SI,SI,SI,SI,FALTA DE AULA PARA DESARROLLO DE CLASE EN TURNO OPUESTO,SAN PEDRO,2
78,208083,1763,COL. NACIONAL DOMINGO SAVIO,,SAN ESTANISLAO,BO SAN BLÁS,RURAL,COL. DEF. DEL CHACO,4,180,E.E.B. Y NIVEL MEDIO,POLIDEPORTIVO,1,SI,SI,SI,SI,"LUGAR ADECUADO PARA LA CLASE DE ED. FÍSICA, RECREACIÓN Y EVENTOS ESCOLARES.",SAN PEDRO,2
148,208084,1764,ESC. BÁS. N° 3943 SAN ANTONIO,,SAN ESTANISLAO,CALLE 8000 BERTONI,RURAL,CALLE 8000 BERTONI,4,33,EI Y E.E.B,AULAS,3,SÍ,SI,SI,SI,DEFICIT,SAN PEDRO,2
14,217004,1767,ESC. BÁS.  N° 3037  1° DE NOVIEMBRE,,CAPIIBARY,CALLE 1° DE NOVIEMBRE,RURAL,CALLE 1° DE NOBIEMRE,2,179,E.E.B,AULAS,3,CORPOSANA,ANDE,MEC,SI,"FALTA DE AULAS PARA P.E., 7°, 8° Y 9° GRADO Y LA PARTE ADMINISTRATIVA.",SAN PEDRO,2
29,217005,1768,ESC. BÁS. N° 3545 SAN RAFAEL,,CAPIIBARY,A. 3 DE NOBIEMBRE,RURAL,3 DE NOVIEMBRE,2,,E.E.B,DIRECCIÓN,1,SENASA,ANDE,MEC,SI,"BRINDAR COMODIDAD Y SEGURIDAD TANTO A ALUMNOS/AS Y DOCENTES, PARA ASEGURAR UN APREDINSAJE EFECTIVO.",SAN PEDRO,2
23,217006,1769,ESC. BÁS. N° 3048 DR. VICENTE SARUBBI ZALDIVAR,,CAPIIBARY,3 DE NOVIEMBRE,,3 DE NOVIEMBRE,2,186,E.E.B Y E.M ,DIRECCIÓN,1,,ANDE,MEC,SI,ACTUALMENTE CARECEMOS DE ESPOACIO CON INFRAESTRUCTURA EDILICIA PARA DIRECCIÓN Y SECRETARIA.,SAN PEDRO,2
30,217007,1770,ESC. BÁS. N° 4542 SAN MIGUEL ,,CAPIIBARY,SAN MIGUEL,RURAL,3 DE NOVIEMBRE,2,20,E.E.B,AULAS,3,SENASA,ANDE,MEC,SI,POR CRECIMIENTO DE MATRICULADOS Y PRECARIEDAD DE INFRAESTRUCTURA . POR NECESIDAD Y DISTANCIAMENTO DE UNA INSTITUCIÓN A OTRO.,SAN PEDRO,2
17,217009,1772,ESC. BÁS. N° 3030  25 DE DICIEMBRE,,CAPIIBARY,CALLE 25 DE DICIEMBRE.,RURAL,CAPIIBARY,2,100,E.E.B,AULAS,3,,,,,TODAS LAS AULAS ESTA ABSOLUTO Y GENERA RIESGO A 100 NIÑOS/AS.,SAN PEDRO,2
21,217011,1774,ESC. BÁS. N° 3049 VIRGEN DE FÁTIMA,,CAPIIBARY,B° VIRGEN DE FÁTIMA,RURAL,CALLE 3 DE NOVIEMBRE,2,85,E.E.B,AULAS,3,,,,,NUESTRA INSTITUCIÓN ES DE MADERA CON 23 AÑOS DE ANTIGÜEDAD Y YA NO OFRESE NINGUNA GARANTÍA A LOS EDUCANDOS Y A LOS DOCENTES.,SAN PEDRO,2
18,217012,1775,ESC. BÁS. N° 4527 NUESTRA SEÑORA DE LA ASUNCIÓN,,CAPIIBARY,A. 10 DE JUNIO,RURAL,A. 10 DE JUNIO,2,180,E.E.B,AULAS,6,POZO COMÚN,,,SI,LAS AULAS CON QUE DISPONEN LA ESCUELA SON DE PEQUEÑAS CONDICIONES CONSTRUIDO POR LOS PADRES LO CUAL DIFICULTA EL APRENDIZAJE DE LOS EDUCANDOS.,SAN PEDRO,2
59,217015,1776,ESC. BÁS. N° 3028 SAN ROQUE GONZALEZ DE SANTA CRUZ,,CAPIIBARY,CALLE 8 DE DICIEMBRE,RURAL,,2,140,E.E.B,AULAS,1,SENASA,ANDE,EN GESTIÓN,SI,QUEREMOS CONTAR CON ESTOS  PEDIDOS POR QUE EL PREECOLAR FUNCIONA CON OTRO GRADO Y A LA INSTITUCIÓN LE FALTA CERCADO.,SAN PEDRO,2
24,217016,1779,ESC. BÁS. N° 3027 SANTA ROSA,,CAPIIBARY,,RURAL,CALLE 30 DE AGOSTO,2,138,E.E.B,AULAS,4,CORPOSANA,,,SI,"LA INSTITUCIÓNTIENE 24 AÑOS DE FUNDACIÓN, Y UNO DE LOS PABELLONES SE ENCUENTRA EN ESTADO DEPLORABLE, POR LO TANTO ES NECESARIO LA CONSTRUCCIÓN URGENTE DE UN NUEVO PABELLÓN.",SAN PEDRO,2
58,217019,1782,ESC. BÁS. N° 4526 SANTA LIBRADA,,CAPIIBARY,CALLE 20 DE JULIO L.O,RURAL,CALLE 20 DE JULIO,2,35,E.E.B,AULAS,3,SENASA,ANDE,NO,SI,QUEREMOS CONTAR CON ESTOS PEDIDOS POR QUE LA INSTITUCIÓN NO CUENTA CON AULAS ADECUADAS A LOS NIÑOS/AS DE LA COMUNIDAD.,SAN PEDRO,2
60,217022,1785,ESC. BÁS. N° 3026 SANTA LIBRADA,,CAPIIBARY,COMPAÑÍA 20 DE JULIO,RURAL,CALLE 20 DE JULIO,2,68,E.E.B,AULAS,1,SENASA,ANDE,NO,SI,QUEREMOS CONTAR CON ESTOS PEDIDOS POR QUE EL PREESCOLAR Y LA DIRECCIÓN FUNCIONA CON OTRO GRADO.,SAN PEDRO,2
61,217022,1785,ESC. BÁS. N° 3026 SANTA LIBRADA,,CAPIIBARY,COMPAÑÍA 20 DE JULIO,RURAL,CALLE 20 DE JULIO,2,68,E.E.B,DIRECCIÓN,1,SENASA,ANDE,NO,SI,QUEREMOS CONTAR CON ESTOS PEDIDOS POR QUE EL PREESCOLAR Y LA DIRECCIÓN FUNCIONA CON OTRO GRADO.,SAN PEDRO,2
26,217025,1788,ESC. BÁS. N° 2481 MCAL. F. S. LÓPEZ,,CAPIIBARY,1° DE MARZO,URBANA,1° DE MARZO,2,,E.E.B,AULAS,3,J. DE SANEAMIENTO,ANDE,MEC,SI,POR ATENTAR CONTRA LA VUDA DE LOS ALUMNOS/AS.,SAN PEDRO,2
15,217026,1789,ESC. BÁS. N° 3050 4 DE MAYO,,CAPIIBARY,4 DE MAYO,URBANA,,2,280,E.E.B,AULAS,4,CORPOSANA,ANDE,MEC,SI,AUMENTO DE MATRICULADOS PARA MEJOR ORGANIZACIÓN.,SAN PEDRO,2
31,217027,1790,ESC. BÁS. N° 4543 SAN ISIDRO,,CAPIIBARY,A. SAN ISIDRO ,RURAL,A. SAN ISIDRO,2,80,E.E.B,AULAS,3,SENASA,ANDE,MEC,SI,"LA CONSTRUCCIÓN ACTUAL ES DE MADERA Y MUY PRECARIA, Y DESEAMOS BRINDRAR MÁS COMODIDAD Y SEGURIDAD TANTO A ALUMNOS/AS Y DOCENTES, PARA ASEGURAR UN APRENDISAJE EFECTIVO.",SAN PEDRO,2
19,217029,1792,ESC.BÁS.N° 4528 MCAL. J. F. ESTIGARRIBIA.,,CAPIIBARY,12 DE JUNIO,RURAL,12 DE JUNIO,2,115,E.E.B,AULAS,4,POTABLE PRIVADO,ANDE,MEC,SI,"EN LA INSTITUCIÓN NECESITAMOS MÁS AULAS PARA EDUCACION INICIAL Y 3° CICLO POR QUE DE LO QUESE DISPONE, TIENE ESPACIO CHICO Y TAMBIEN ES DE MADERA LA PARED YA ES VIEJO.",SAN PEDRO,2
33,217036,1799,ESC. BÁS. N° 4532 HEROES DEL CHACO,,CAPIIBARY,CALLE PAZ DEL CHACO,RURAL,ARA PYAHU,2,,E.E.B,DIRECCIÓN,1,J. DE SANEAMIENTO,ANDE,SI,SI,POR QUE ES UN CENTRO EDUCATIVO  Y NECESITA DE ESPACIOS PAR REUNIONES Y OTRAS ACTIVIDADES CON LOS DOCENTES DE LAS ESCUELAS ASOCIADAS.,SAN PEDRO,2
34,208240,1802,ESC. BÀS. Nª 4531 VIRGEN DEL CARMEN,,CAPIIBARY,CALLE 16 DE JULIO,RURAL,ARA PYAHU,2,20,E.E.B,AULAS,2,J. DE SANEAMIENTO,ANDE,SI,SI,POR QUE LA ESCUELA NECESITA DE MÀS ESPACIOS ÀULICOS PRINCIPALMENTE PARA DIRECCIÒN Y AULA PAR PREESCOLAR.,SAN PEDRO,2
36,217042,1805,ESC.BÀS. Nª 4650 DR.J. G. R. DE FRANCIA,,CAPIIBARY,A. 26 DE FEBRERO,RURAL,A. 26 DE FEBRERO,2,164,E.E.B,AULAS,1,SENASA,ANDE,MEC,SI,AULA PARA EDUCACIÒN INICIAL Y DIRECCIÓN  PARA MEJOR CONSERVACIÓN DE LOS DOCUMENTOS.,SAN PEDRO,2
67,217048,1811,ESC. BÀS. Nª  4538 SAN JOSE,,CAPIIBARY,CALLE PAZ DEL CHACO,RURAL,ARA PYAHU,2,,E.E.B,AULAS,1,J. DE SANEAMIENTO,ANDE,SI,SI,LA ESCUELA  NO POSEE SALA PARA SECRETARIA Y TIENE EN FUNCIONAMIENTO HASTA 9ª GRADO. LA ESCUELA NECESITA UN AULA PARA 8ª Y 9ª GRADO YA QUE SON EDUCADOS DEBAJO DE UN TECHO QUE NO REUNE LAS CONDICIONES NO CUENTA CON UNA SALA PARA CRA.,SAN PEDRO,2
37,217052,1815,ESC. BÀS. Nª 4530 CARMEN SPERATTI DE MARTINEZ,,CAPIIBARY,A. 1ª DE MARZO,RURAL,A. 1ª DE MARZO,2,146,E.E.B,AULAS,3,SENASA,ANDE,MEC,SI,DEFICIT DE AULAS POR CRECIMIENTO DE MATRICULA.,SAN PEDRO,2
141,208147,1827,ESC. BÁS. N° 4970 PRIV. SUBV. CRUZ ROJA,,SAN ESTANISLAO,B° YCUA PAÍ,URBANA,B° YCUA PA'I,4,19,EI,AULAS,1,SÍ,SI,SI,SI,DEFICIT,SAN PEDRO,2
80,208237,1847,COLEGIO NAC. BARRIO REPUBLICANO,,SAN ESTANISLAO,REPUBLICANO,RURAL,,4,160,E.E.B. Y N.M.,AULAS,3,SI,SI,SI,SI,LOS ALUMNOS SE ENCUENTRAN DANDO CLASES BAJO LOS ÁRBOLES,SAN PEDRO,2
81,208237,1847,COLEGIO NAC. BARRIO REPUBLICANO,,SAN ESTANISLAO,REPUBLICANO,RURAL,,4,160,E.E.B. Y NIVEL MEDIO,AULAS,4,SI,SI,SI,SI,LOS ALUMNOS SE ENCUENTRAN DANDO CLASES BAJO LOS ÁRBOLES,SAN PEDRO,2
128,208029,1848,COL. NAC. KUARAHY RESE,,SAN ESTANISLAO,CALLE 10000 DEF. DEL CHACO,RURAL,,4,300,E.E.B. Y NIVEL MEDIO,AULAS,2,SI,SI,SI,SI,DÉFICIT,SAN PEDRO,2
137,208234,1851,COL. NAC. DE TACUARA,,SAN ESTANISLAO,TACUARA,RURAL,,4,160,E.E.B. Y NIVEL MEDIO,"DIRECCIÓN,BIBIOTECA",2,SI,SI,SI,SI,DÉFICIT,SAN PEDRO,2
108,208045,1853,COL. NAC. SANTA TERESA,,SAN ESTANISLAO,10000 SANTA TERESA,RURAL,,4,190,"E.I., E.E.B. Y NIVEL MEDIO",BIBLIOTECA,1,SI,SI,SI,SI,DÉFICIT,SAN PEDRO,2
95,208078,1863,COL. DR. RAÚL PEÑA,,SAN ESTANISLAO,GUAICA,RURAL,,4,83,E.E.B.,AULAS,2,SI,SI,SI,SI,DÉFICIT,SAN PEDRO,2
136,208036,1876,COL. NAC. SAN JOSÉ,,SAN ESTANISLAO,CALLE 8000 DEF. DEL CHACO,RURAL,,4,25,NIVEL MEDIO,DIRECCIÓN,1,SI,SI,SI,SI,DÉFICIT,SAN PEDRO,2
16,217061,1881,ESC. BÁS. N° 4649 DON CARLOS ANTONIO LÓPEZ,,CAPIIBARY,12 DE JUNIO,RURAL,BERNARDINO CABALLERO,2,125,,AULAS,4,POTABLE,ANDE,MEC,SI,POR QUE NO CONTAMOS CON AULAS ADECUADA Y ALGUNOS GRADOS ESTA AFUERA DANDO CLASE.,SAN PEDRO,2
20,217059,1882,ESC. BÁS. N° 4651 SANTO DOMINGO,,CAPIIBARY,CALLE SANTO DOMINGO,RURAL,,2,82,E.E.B,AULAS,,CORRIENTE,ANDE,MEC,SI,"LA INSTITUCIÓN CUENTA CON AULAS DE TECHO CON FIBRAS DE CEMENTOS AGUJEREADOS POR EL TEMPORAL, PAREDES DE TABLAS DETERIORADAS, LA MISMA ATENTA CONTRA LA INTEGRIDAD DE LOS EDUCANDOS.",SAN PEDRO,2
28,2170082,1883,ESC. BÁS. N° 4648 E. R. FERNANDEZ,,CAPIIBARY,A. 11 DE SEPTIEMBRE,RURAL,A. 11 DE SEPTIEMBRE,2,,E.E.B,AULAS,4,SENASA,ANDE,EN GESTIÓN,SI,PARA ALBERGAR A MÁS ALUMNOS.,SAN PEDRO,2
32,217063,1884,ESC. BÁS. N° 4655 CNEL. J. F. LÓPEZ,,CAPIIBARY,A. 3 DE NOBIEMBRE,RURAL,A. 3 DE NOVIEMBRE,2,227,E.E.B,AULAS,4,SI,SI,SI,SI,DEVIDO A QUE LA MAYORIA DE LOS GRADOS FUNCIONA EN AULAS DE MADERA Y NO CUENTA CON LOS ESPACIOS Y COMODIDADES REQUERIDO Y UN ESPACIO PARA LA. DIRECCIÓN YA QUE ESTAMOS IMPROVISANDO DICHO ESPACIO EN UN AULA DE MADERA PRECARIA.,SAN PEDRO,2
147,208174,1894,ESC. BÁS. N° 7244 PRIV SUBV SAN LUIS,,SAN ESTANISLAO,MONTE ALTO,URBANA,MONTE ALTO,4,48,EI,AULAS,1,SÍ,SI,SI,SI,DEFICIT,SAN PEDRO,2
25,217066,1897,ESC. BÁS. N° 6019 SANTA LUCIA,,CAPIIBARY,A. 11 DE SEPTIEMBRE,RURAL,11 DE SEPTIEMBRE ,2,,E.E.B,AULAS,1,CORPOSANA,ANDE,NO,SI,NO CUENTA CON SALAS DE CLASE.,SAN PEDRO,2
130,208055,1902,COL. NAC. SAN PEDRO APOSTOL,,SAN ESTANISLAO,TACURUTY,RURAL,,4,240,E.E.B. Y NIVEL MEDIO,AULAS,2,SI,SI,SI,SI,DÉFICIT,SAN PEDRO,2
10,217068,1906,ESC. BÀS. Nª 7113 PRIV. SUBV. JUAN PABLO II,,CAPIIBARY,B° MARIA AUXILIADORA,URBANA,B° MARIA AUXILIADORA,2,130,E.E.B,AULAS,3,CORPOSANA,ANDE,DIÓCESIS DE SAN PABLO APÓSTOL,,NECESITAMOS MÁS CONSTRUCCIÓN DE AULA POR LA CANTIDAD DE ALUMNOS QUE TENEMOS.,SAN PEDRO,2
85,208197,1918,"ESC. BÁS. N° 6621 ""VIRGEN DE CA´ACUPE""",,SAN ESTANISLAO,BO 8 DE DICIEMBRE,URBANA,,4,151,E.I. Y E.E.B.,AULAS,7,SI,SI,SI,SI,DÉFICIT,SAN PEDRO,2
87,208198,1919,"ESC. BÁS. N°6620 ""SAN BLÁS""",,SAN ESTANISLAO,BO SAN BLÁS,URBANA,,4,16,E.I.,AULAS,1,SI,SI,SI,SI,DÉFICIT,SAN PEDRO,2
88,208198,1919,"ESC. BÁS. N°6620 ""SAN BLÁS""",,SAN ESTANISLAO,BO SAN BLÁS,URBANA,,4,,E.E.B.,DIRECCIÓN,1,SI,SI,SI,SI,DÉFICIT,SAN PEDRO,2
38,217060,1921,ESC. BÀS. Nª 5012 SAN EUGENIO ,,CAPIIBARY,SAN EUGENIO ,RURAL,1º DE MARZO,2,107,E.E.B,AULAS,5,SI,SI,SI,SI,EN UN AMBIENTE ADECUADO EL APRENDISAJE ES MÀS RAPIDO.,SAN PEDRO,2
3,210013,1943,ESC. BÁS.Nº13686,,TACUATI,ÑU RUGUA,RURAL,ÑU RUGUA,1,49,E.E.B,AULAS,2,SI,SI,SI,SI,NUEVA CONSTRUCCIÓN,SAN PEDRO,2
90,211012,1975,"ESC. BÁS Nº3775 ""AGUSTÍN BARRIOS""",3775,SAN ESTANISLAO,SOTO CUÉ,RURAL,,4,60,E.E.B.,AULAS,1,SI,SI,SI,SI,DÉFICIT,SAN PEDRO,2
185,021 2009,1984,"ESC. BÁSICA Nº 2738 ""SAN ISIDRO",,25 DE DICIEMBRE,SAN ISIDRO,RURAL,,7,55,E.I. Y E.E.B.,AULAS,3,J. DE SANEAMIENTO,ANDE,SI,SI,FUNCIONA EN ESPACIO MUY REDUCIDO ,SAN PEDRO,2
194,021 2013,1993,"ESC. BÀS.Nº 656 ""DR. FERNANDO DE LA M.",,25 DE DICIEMBRE,MBOIY,RURAL,,7,19,E.I,AULAS,1,J. DE SANEAMIENTO,ANDE,SI,SI,FUNCIONA EN ESPACIO MUY REDUCIDO ,SAN PEDRO,2
197,021 2013,1993,"ESC.BÀS.Nº 656 ""DR.FERNANDO DE LA M",,25 DE DICIEMBRE,MBOIY,RURAL,,7,,E.E.B.,"SALA  P/INFORMATICO ,CERCADO",1,J. DE SANEAMIENTO,ANDE,SI,SI,FUNCIONA EN ESPACIO MUY REDUCIDO ,SAN PEDRO,2
183,021 2032,2002,"COLEGIO NACIONAL ""SAN PABLO""",,25 DE DICIEMBRE,SAN ISIDRO,RURAL,,7,45,N.M.,AULAS,3,J. DE SANEAMIENTO,ANDE,EN GESTIÓN,SI,LOS 3 CURSOS FUNCIONAN BAJO ÁRBOLES,SAN PEDRO,2
184,021 2010,2003,"COLEGIO NACIONAL ""SAN JUAN""",,25 DE DICIEMBRE,COLONIA NAVIDAD,RURAL,,7,123,COMPARTIDO,AULAS,4,J. DE SANEAMIENTO,ANDE,SI,SI,EL COLEGIO NO CUENTA CON AULAS PROPIOS,SAN PEDRO,2
195,021 2030,2005,COL. NAC. INMACULADA CONCEPCIÒN,,25 DE DICIEMBRE, POTRERO YBATÈ,RURAL,,7,,N.M.,DIRECCIÓN,1,J. DE SANEAMIENTO,ANDE,SI,SI,FUNCIONA EN ESPACIO MUY REDUCIDO ,SAN PEDRO,2
45,_,2045,ESC. BÁS. N° 997 VIRGEN DE FÁTIMA,,GRAL. RESQUÍN,VIRGEN DE FATIMA,URBANA,,8,575,E.E.B,AULAS,3,SENASA,ANDE,MEC,SI,POR NECESIDAD,SAN PEDRO,2
42,_,2046,COLEGIO  NAC.GRAL RESQUIN,,GRAL. RESQUÍN,VIRGEN DE FATIMA,RURAL,,8,240,3º  C.E.E.B,AULAS,1,SENASA,ANDE,MEC,SI,NECESIDAD POR CANT. DE ALUMNOS,SAN PEDRO,2
28,214002,2047,ESC. 4129 MARIA AUXILIADORA,,GRAL. RESQUÍN,MAÍA AUXILIADORA,RURAL,SAN VICENTE,8,135,E.E.B,AULAS,3,SENASA,ANDE,MEC,SI,PARA ALBERGAR A MAS ALUMNOS,SAN PEDRO,2
50,_,2047,"ESC. BÁS. N° 7312 ""SAN BLAS""",,SANTA ROSA DEL AGUARAY,ASENT. FFELIPE OSORIO,RURAL,ASENT. FELIPE OSORIO,4,180,E.I. Y E.E.B.,"AULAS, SALA DE PROFESORES, BIBLIOTECA,LABORATORIO",4,SENASA,ANDE,EN GESTIÓN,SI,PARA EL MEJOR DESARROLLO Y CONOCIMIENTO DE LOS ALUMNOS.,SAN PEDRO,2
27,_,2048,COLEGIO NAC. 1º DE MARZO,de,GRAL. RESQUÍN,1º DE MARZO,RURAL,SAN VICENTE,8,33,E.M ,AULAS,3,SENASA,ANDE,MEC,SI,NO TIENEN AULAS,SAN PEDRO,2
33,214008,2052,ESC. BÁS.4128 SAN FRANCISCO DE ASIS,,GRAL. RESQUÍN,CRUCE SAN VICENTE,RURAL,SAN VICENTE,8,215,E.E.B,AULAS,3,SENASA,ANDE,MEC,SI,PARA MEJORAR ASPECTOS ESTETICOS,SAN PEDRO,2
53,_,2052,"ESC. BÁS. N° 7105 ""MCAL. JOSÉ FÉLIX ESTIGARRIBIA""",,SANTA ROSA DEL AGUARAY,CALLE 1,RURAL,ASENT. JAGUARETE FOREST,4,20,E.I.,SALA PARA PREESCOLAR ,1,POZO ARTESIANO,ANDE,INDERT,SI,SE NECESITA UN ESPACIO ADECUADO PARA EL DESARROLLO DE LAS TAREAS DOCENTE-ALUMNO.,SAN PEDRO,2
22,_,2054,ESC. BÁS. 4495 COSTA RICA,,GRAL. RESQUÍN,COSTA RICA,RURAL,SAN VICENTE,8,65,E.E.B,AULAS,3,SENASA,ANDE,MEC,SI,NO TIENEN AULAS,SAN PEDRO,2
49,_,2054,"ESC. BÁS. N° 4002 ""SAN FELIPE Y SANTIAGO""",,LIMA,LIMA,RURAL,SAN FELIPE Y SANTIAGO,7,,E.E.B.,DIRECCIÓN,1,SENASA,ANDE,MEC,SI,DÉFICIT.,SAN PEDRO,2
95,,2056,COLEGIO NACIONAL SANTA LIBRADA,,LORETO,SANJA CUE,RURAL,,2,94,NIVEL MEDIO,AULAS,2,POZO ARTESIANO,ANDE,MEC,SI,,CONCEPCION,1
96,,2056,COLEGIO NACIONAL SANTA LIBRADA,,LORETO,SANJA CUE,RURAL,,2,94,NIVEL MEDIO,BIBLIOTECA,1,POZO ARTESIANO,ANDE,MEC,SI,,CONCEPCION,1
97,,2056,COLEGIO NACIONAL SANTA LIBRADA,,LORETO,SANJA CUE,RURAL,,2,94,NIVEL MEDIO,LABORATORIO INFORMÁTICO,1,POZO ARTESIANO,ANDE,MEC,SI,,CONCEPCION,1
15,214010,2056,ESC. BÁS. 2712 SAN JOSÉ,,GRAL. RESQUÍN,SAN JOSE ,RURAL,SAN VICENTE,8,375,E.E.B,AULAS,3,SENASA,ANDE,MEC,SI,POR ATENTAR CONTRA LA VIDA DE ALUMNOS,SAN PEDRO,2
23,_,2077,COLEGIO NAC. ESTRELLITA,,GRAL. RESQUÍN,ESTRELLITA,RURAL,ESTRELLITA,8,60,E.M ,AULAS,3,SENASA,ANDE,MEC,SI,NECESIDAD POR CANT. DE ALUMNOS,SAN PEDRO,2
31,_,2098,COLEGIO  NAC. SAN JOSÉ,,GRAL. RESQUÍN, SAN   JOSÉ,RURAL,,8,210,E.M ,AULAS,3,SENASA,ANDE,MEC,SI,NECESIDAD POR CANT. DE ALUMNOS,SAN PEDRO,2
1,21463,2107,ESC. BÁS. Nº5838 ,,GRAL R,STA. LUCIA,RURAL,STA. LUCIA,1,90,E.E.B,AULAS,3,SI,SI,SI,SI,NUEVA CONSTRUCCIÓN,SAN PEDRO,2
200,213004,2108,COLEGIO NACIONAL DE VILLA DEL ROSARIO,,VILLA DEL ROSARIO,VILLA DEL ROSARIO,URBANA, ,1,10,E.M YT,AULAS,1,SENASA,ANDE,MEC,SI,LOS ALUMNOS/AS DEL 3º CURSO B.T.S.NO TIENEN SALAS PROPIAS,SAN PEDRO,2
15,_,2113,COLEGIO NAC.  NIÑO JESÚS,,GRAL. RESQUÍN,SAN RAMÓN,RURAL,SAN VICENTE,8,20,E.M ,AULAS,3,SENASA,ANDE,MEC,SI,NO TIENEN AULAS,SAN PEDRO,2
34,_,2114,COLEGIO  NAC.SAN JOSÉ DEL NORTE,,GRAL. RESQUÍN,SAN JOSE  DEL NORTE,RURAL,SAN JOSE DEL NORTE,8,75,E.M ,AULAS,3,SENASA,ANDE,MEC,SI,POR ATENTAR CONTRA LA VIDA DE ALUMNOS,SAN PEDRO,2
3,216048,2198,ESC BASICA Nº 1681NTRA. SRA DE LA ASUNCION,1681Ntra,GUAJAYVI,CALLE NTRA SRA DE LA ASUNCIÓN,RURAL,………………………..,9,130,P.E. AL 9º GRADO,"AULAS, BIBLIOTECA, DIRECCIÓN",3,SI,SI,SI,,"SE CUENTA CON 1000 LIBROS APROXIMADAMENTE EN UN LUGAR INAPROPIADO. PARA MEJORAR EL APRENDIZAJE CONTANDO CON CON AULA ADECUADA, PORQUE FUNCIONA EN LA SALA DEL 3º CICLO. LA INSTITUCIÓN NO CUENTA CON NINGUNA CLASE DE SALA QUE GARANTIZA EL BUEN MANTENIMIENTO DE LOS DOCUMENTOS ADMINISTRATIVOS.",SAN PEDRO,2
6,1701005,2352,COLEGIO NACIONAL ADOLFO ROJAS SILVA,,BAHÍA NEGRA,BAHÍA NEGRA,URBANA,,1,99,COMPARTIDO,BIBLIOTECA,1,SENASA,ANDE,MEC,SI,PARA OPTIMIZACIÓN DE PROCESO ENSEÑANZA-APRENDIZAJE,ALTO PARAGUAY,17
83,505014,3547,COL.NAC. SAN MIGUEL ARCÁNGEL,,STA.ROSA,ÑATIURY GUAZÚ,RURAL, ,9,40,NIVEL MEDIO,AULAS,1,SENASA,ANDE,SÍ,SI,POR DEFICIT,CAAGUAZU,5
5,_,2775,COLEGIO   NAC.MARÍA AUXILIADORA,,GRAL. RESQUÍN,MARÍA AUXILIADORA,RURAL,SAN VICENTE,8,90,E.M ,AULAS,3,SENASA,ANDE,MEC,SI,NO TIENEN AULAS,SAN PEDRO,2
38,501022,3144,COL. NAC.  E.M.D. SAN ROQUE GONZÀLEZ DE SANTACRUZ,,CORONEL OVIEDO,Bº SAN MIGUEL,URBANA,,2,100,NIVEL MEDIO,AULASS,2,ESSAP,ANDE,M E C,SI,"FALTA SALA DE CLASES, Y SALA DE PROCEDIMIENTOS PARA BTS",CAAGUAZU,5
26,501031,3153,ESC. BÁS. N° CAPITÁN JUAN ALBERTO ROA,,C. OVIEDO,CAPITÁN ROA,URBANA,.,1,100,NIVEL MEDIO,AULAS,3,ESSAP,SI,SI,SI,SALAS NUEVAS PARA EL NIVEL MEDIO,CAAGUAZU,5
27,501031,3153,ESC. BÁS. N° CAPITÁN JUAN ALBERTO ROA,,C. OVIEDO,CAPITÁN ROA,URBANA,.,1,963,E.E.B Y N. MEDIO,BIBLIOTECA,1,ESSAP,SI,SI,SI,SALA NUEVA PARA BIBLIOTECA,CAAGUAZU,5
39,501035,3158,COL. NAC. DR. DOMINGO MONTANARO,,CORONEL OVIEDO,COL. DR. D. MONTANARO,RURAL,COL. DR. D. MONTANARO,2,35,NIVEL MEDIO,AULAS,2,POZO ARTECIANO,ANDE,MEC,SI,CONSTRUCCION  DE 2  AULAS PARA 2º Y 3º BTA,CAAGUAZU,5
54,501038,3160,LICEO NACIONAL CHIRCATY,,CORONEL OVIEDO,CHIRCATY,RURAL,  ,2,15,NIVEL MEDIO,AULAS,1,POZO ARTESIANO,ANDE,M.E.C.,SI,LA INSTITUCIÒN NO CUENTA AULA PARA EL 3º CURSO POR LO QUE ES UNA NECESIDAD URGENTE,CAAGUAZU,5
55,501038,3160,LICEO NACIONAL CHIRCATY,,CORONEL OVIEDO,CHIRCATY,RURAL,  ,2,96,E.E.B Y N. MEDIO,SECRETARÍA,1,POZO ARTESIANO,ANDE,M.E.C.,SI,LA INSTITUCIÒN NO CUENTA CON ESPACIO DESTINADO PARA SECRETARIA,CAAGUAZU,5
56,501038,3160,LICEO NACIONAL CHIRCATY,,CORONEL OVIEDO,CHIRCATY,RURAL,  ,2,96,E.E.B Y N. MEDIO,BIBLIOTECA,1,POZO ARTESIANO,ANDE,M.E.C.,SI,LA INSTITUCIÒN NO CUENTA CON ESPACIO DESTINADO PARA BIBLIOTECA,CAAGUAZU,5
57,501038,3160,LICEO NACIONAL CHIRCATY,,CORONEL OVIEDO,CHIRCATY,RURAL,  ,2,96,E.E.B Y N. MEDIO,LABORATORIO,1,POZO ARTESIANO,ANDE,M.E.C.,SI,LA INSTITUCIÒN NO CUENTA CON ESPACIO DESTINADO PARA LABORATORIO,CAAGUAZU,5
58,501038,3160,LICEO NACIONAL CHIRCATY,,CORONEL OVIEDO,CHIRCATY,RURAL,  ,2,96,E.E.B Y N. MEDIO,POLIDEPORTIVO,1,POZO ARTESIANO,ANDE,M.E.C.,SI,LA INSTITUCIÒN NECESITA CONTAR CON UN POLIDEPORTIVO ,CAAGUAZU,5
4,501042,3163,COL. NAC. GENARO ROMERO,,C. OVIEDO,GENARO ROMERO,RURAL,.,1,150,NIVEL MEDIO,AULAS,1,POZO ARTESIANO ,SI,SI,SI,DÉFICIT.,CAAGUAZU,5
5,501042,3163,COL. NAC. GENARO ROMERO,,C. OVIEDO,GENARO ROMERO,RURAL,.,1,70,NIVEL MEDIO,AULAS,1,POZO ARTESIANO ,SI,SI,SI,DÉFICIT.,CAAGUAZU,5
3,501043,3164,COL. NAC. YUQUYTY,,C. OVIEDO,YUQUYTY,RURAL,.,1,71,NIVEL MEDIO,AULAS,3,POZO ARTESIANO ,SI,SI,SI,"DÉFICIT, PLANTA ALTA",CAAGUAZU,5
59,501044,3165,COLEGIO NACIONAL SANTA LIBRADA,,CORONEL OVIEDO,SANTA LIBRADA,RURAL,  ,2,13,NIVEL MEDIO,AULAS,1,POZO ARTESIANO,ANDE,M.E.C.,SI,EL 2º CURSO FUNCIONA EN AULA PRECARIA,CAAGUAZU,5
28,501045,3166,COL. NAC. DE EMD DR. PEDRO P. PEÑA,,C. OVIEDO,SAN ISIDRO,URBANA,.,1,1399,NIVEL MEDIO,POLIDEPORTIVO,1,ESSAP,SI,SI,SI,POR DÉFICIT.,CAAGUAZU,5
52,501045,3166,COLEGIO NACIONAL DR. PEDRO P. PEÑA,,CORONEL OVIEDO,SAN ANTONIO,RURAL,  ,2,125,E.E.B Y N. MEDIO,LABORATORIO DE INFORMÁTICA,1,POZO PRIVADO,ANDE,M.E.C.,SI,ES UNA NECESIDAD URGENTE EN LA INSTITUCIÒN,CAAGUAZU,5
48,501047,3168,COL. NAC. DR. IGNACIO A. PANE,,CORONEL OVIEDO,CALLE 1.80,RURAL,COL. BLAS GARAY ,2,109,E.E.B Y N. MEDIO,DIRECCIÓN,1,POZO COMÚN,ANDE,M.E.C.,SI,ES UNA NECESIDAD URGENTE EN LA INSTITUCIÒN,CAAGUAZU,5
49,501047,3168,COL. NAC. DR. IGNACIO A. PANE,,CORONEL OVIEDO,CALLE 1.80,RURAL,COL. BLAS GARAY ,2,109,E.E.B Y N. MEDIO,SECRETARÍA,1,POZO COMÚN,ANDE,M.E.C.,SI,ES UNA NECESIDAD URGENTE EN LA INSTITUCIÒN,CAAGUAZU,5
50,501047,3168,COL. NAC. DR. IGNACIO A. PANE,,CORONEL OVIEDO,CALLE 1.80,RURAL,COL. BLAS GARAY ,2,109,E.E.B Y N. MEDIO,BIBLIOTECA,1,POZO COMÚN,ANDE,M.E.C.,SI,ES UNA NECESIDAD URGENTE EN LA INSTITUCIÒN,CAAGUAZU,5
51,501047,3168,COL. NAC. DR. IGNACIO A. PANE,,CORONEL OVIEDO,CALLE 1.80,RURAL,COL. BLAS GARAY ,2,109,E.E.B Y N. MEDIO,LABORATORIO,1,POZO COMÚN,ANDE,M.E.C.,SI,ES UNA NECESIDAD URGENTE EN LA INSTITUCIÒN,CAAGUAZU,5
42,501053,3174,COL. NAC. DR. BLAS GARAY,,CORONEL OVIEDO,CALLE 2 BLAS GARAY,RURAL,COL. BLAS GARAY ,2,191,NIVEL MEDIO,AULAS,1,POZO ARTESIANO,ANDE,M.E.C.,SI,SE NECESITA UN AULA DESTINADO PARA LABORATORIO,CAAGUAZU,5
6,501063,3184,COL. NAC. AGUAPETY,,C. OVIEDO,AGUAPETY - PORTÓN,RURAL,.,1,300,MEDIA TEC.,"AULAS,LABORATORIO",1,POZO ARTESIANO ,SI,SI,SI,BTC. FUNCIONA BAJO ÁBOLES O PATIO DE LA INSTITUCIÓN,CAAGUAZU,5
2,501081,3202,ESC. BÁS. N° 321 CÁNDIDO RIVAS,,C. OVIEDO,TUYU PUCU,RURAL,.,1,50,NIVEL MEDIO,AULAS,1,POZO ARTESIANO ,SI,SI,SI,DÉFICIT.,CAAGUAZU,5
