36,502026,3308,"ESC. BÁS. Nº 3309 ""SAN PEDRO""",3309,CAAGUAZÚ,CÑÍA. COSTA ROSADO,RURAL,,4,107, E.E.B,1,,FALTA DE REPARACIÓN GENERAL.,CAAGUZU,5
35,502029,3311,"ESCUELA BÁSICA Nº 4366 ""MUNICIPAL""",4366,CAAGUAZÚ,Bº BERNARDINO CABALLERO,URBANA,,4,300, E.E.B,6,,FALTA DE REPARACIÓN GENERAL.,CAAGUZU,5
31,502071,3353,"ESC. BÁS. Nº 2787 ""ÑANEMAITEI""",2787,CAAGUAZÚ,ÑANEMAITEI,RURAL,,4,22,E.I.,2,,FALTA DE REPARACIÓN GENERAL.,CAAGUZU,5
12,502070,3352,ESC. BAS. N° 3205 NIÑO JESUS,3205,CAAGUAZU,3RA. LINEA BALANZÁ CÑIA. WALTER INSFRAN,RURAL,,R1ZB,98,"E.E.B 1°, 2° Y 3° CICLO",1,,FALTA DE POZO CIEGO,CAAGUZU,5
10,502079,3361,ESC. BAS. N° 1257 MCAL. JOSE FELIX ESTIGARRIBIA,1257,CAAGUAZU,CALLE SAN MIGUEL,RURAL,,R1ZB,------,"E.I, PE, E.E.B 1°, 2° Y 3° CICLO",10,,REPARACION,CAAGUZU,5
40,502082,3364,"ESC. BÁS. Nº 4362 ""MAYOR E. SÁNCHEZ D.""",4362,CAAGUAZÚ,4ª LÍNEA GUYRAUNGUA'I,RURAL,,4,50,E.E.B,2,,FALTA DE REPARACIÓN GENERAL.,CAAGUZU,5
11,502081,3363,ESC. BAS. N° 1832 SAN JUAN BAUTISTA,1832,CAAGUAZU,OCULTO 5TA. LINEA,RURAL,,R1ZB,20,E.E.B 1° CICLO,3,,FALTA REPARAR LOS SANITARIOS,CAAGUZU,5
5,502084,3366,ESC. BAS. N° 3194 SAN JUAN BAUTISTA,3194,CAAGUAZU,5TA. LINEA LA FABRIL,RURAL,,R1ZB,107,"E.E.B 1°, 2° Y 3° CICLO",6,,REPARACION,CAAGUZU,5
13,502088,3370,ESC. BAS. N° 1252 PROF. ENRIQUE GONZALEZ G. ,1252,CAAGUAZU,4TA. LINEA LA FABRIL 1° DE MAYO,RURAL,VY´A PAGUASU,R1ZB,------,E.E.B ,1,,EL SANITARIO ACTUAL NECESITA REPARACION EN FORMA TOTAL,CAAGUZU,5
14,502077,3359,ESC. BAS. N° 3198 SAN MIGUEL,3198,CAAGUAZU,SAN MIGUEL,RURAL,,R1ZB,------,"E.E.B 1°, 2° Y 3° CICLO",1,,REPARACION,CAAGUZU,5
1,502001,3284,ESC. BAS. N° 316 SAN LORENZO,316,CAAGUAZU,SAN LORENZO,URBANA,,R1ZB,734,E.E.B 2° Y 3° CICLO,2,,FALTA DE REPARACION COMPLETA DE SANITARIOS 38 AÑOS DE USO,CAAGUZU,5
2,502005,3288,ESC. BAS. N° 561 MCAL. LOPEZ,561,CAAGUAZU,CENTENARIO,URBANA,,R1ZB,230,"E.I, E.E.B 1° Y 2° CICLO",2,,MUCHOS AÑOS DE USO Y NECESITA REPARACION,CAAGUZU,5
29,503001,3482, ESC. BAS. Nº 139 MONSEÑOR  HERMENEGILDO ROA,139,CARAYAÓ,CARAYAÓ,URBANA,,9,400, E.I Y E.E.B,2,,"REPOSICIÓN DE CISTERNA, MINGITORIO Y ELECTRICIDAD",CAAGUZU,5
32,503033,10490," ESC. BÁS. 6137 ""ARROYO NORTE""",6137,CARAYAÓ, ASENT.ARROYO NORTE,RURAL,,9,160,"1º ,2º Y 3º C.",2,,DETERIORO TOTAL,CAAGUZU,5
31,503034,4000,"ESC.BÁS.Nº 4315 ""3 DE MAYO""",4315,CARAYAÓ, ASENT.3 DE MAYO,RURAL,,9,178,1º Y 2º C.,3,,"REPOSICIÓN DE CISTERNA, LAVATORIO Y PUERTAS/CEPRA",CAAGUZU,5
36,503017,3498,"ESC.BÁS.Nº 1979 ""SAN FRANCISCO DE ASÍS""",1979,CARAYAÓ, COMPAÑÍA 14.000,RURAL,,9,120,1º Y 2º C.,2,,"REPOSICIÓN DE CISTERNA, LAVATORIO Y PUERTAS",CAAGUZU,5
8,501075,3196,ESC. BÁS. N° 467 MANUEL ORTÍZ GUERRERO,467,C. OVIEDO,AGUAPETY PORTÓN,RURAL,0,1,260,E.E.B,1,0,REPARACIÓN INTEGRAL POR ESTAR MUY DETERIORADO,CAAGUZU,5
9,501080,3201,ESC. BÁS. N° 315 ANTONIO VERA CENTURIÓN,315,C. OVIEDO,ZARO CARO,RURAL,0,1,15,IN-E.E.B,1,0,AMPLIACIÓN DE BAÑO POR SEXO Y REPARACIÓN.,CAAGUZU,5
12,501145,3282,"ESC. BAS. Nº 4746 ""HNO. FELIX ALDUNATE C.""",4746,CNEL. OVIEDO ,LA FLORESTA ,URBANA,,R2,164,1ºY2ºCICLOS,1,,LOS BAÑOS NECESITAN UNA REPARACIÒN  URGENTE,CAAGUZU,5
19,501123,3260,ESCUELA BÁS .Nº6930 DON HÉCTOR ROQUE DUARTE ,6930,CNEL. OVIEDO ,CALLE 2 SAN BLAS,RURAL,COLONIA DR.BLAS GARAY ,R2,30,E.I Y E.E.B,1,,REPARACIÓN DE CAÑERIAS ,CAAGUZU,5
2,501011,3134,ESC. BÁS. N° 1965 JUAN CORONEL BARRIOS ,1965,C. OVIEDO,BOQUERÓN ,URBANA,0,1,172,1° Y 2° CICLO,2,0,POR SER UNA NECESIDAD  PARA EL MEJORAMIENTO DE LA INSTITUCIÓN,CAAGUZU,5
13,501055,3176,ESC. BÁS. Nº 410 ELISA ALICIA LYNCH ,410,CNEL. OVIEDO ,CALLE SAN ROQUE ,RURAL,,R2,115,  E.E.B         1º Y 2º C. ,6,,"NO FUNCIONA EN CONDICIONES, CAÑERÍAS, LAVATORIOS.",CAAGUZU,5
3,501025,3147,ESC. BÁS. N° 4126 SAN MARTÍN DE PORRES,4126,C. OVIEDO,VILLA CONAVÍ,URBANA,0,1,85,E.E.B,3,0,"PUERTAS, PARED.",CAAGUZU,5
16,501035,3157,ESC. BÁSICA Nº 436 DR. DOMINGO MONTANARO,436,CNEL. OVIEDO ,COL. DR. D. MONTANARO,RURAL,COL. DR. D. MONTANARO,R2,170,E.E.B 1 Y 2`C.,3,,"REPARACIÓN DE SISTERNA , WATER, PISOS Y CAÑERIA",CAAGUZU,5
10,501095,3216,ESC. BÁS. N° 4038 SANTA TERESA DE JESÚS,4038,C. OVIEDO,FRACCIÓN MONTELINDO- SAN MIGUEL,RURAL,0,1,23,1° AL 3° C.,1,0,REPARACIÓN INTEGRAL DEL SANITARIO SEXADO,CAAGUZU,5
18,501060,3181,ESC. BÁS. Nº 469 DR. PEDRO P. PEÑA,469,CNEL. OVIEDO ,CALLE SAN ANTONIO,RURAL,,R2,102,E.E.B 1ºY2º C.,6,,"POR REPARACIÓN DE MINGITORIO, W.C, CAÑERIAS  Y LAVATORIOS",CAAGUZU,5
15,501049,3170,ESC. BÁS. Nº 867 SAN JUAN BOSCO  ,867,CNEL. OVIEDO ,CÑÍA. SAN J. BOSCO,RURAL,,R2,54,"EDUC. INICIAL         E.E.B 1º, 2 Y 3ºC.",6,,"REPARACIÓ CAÑERÍAS, LAVATORIOS Y CISTERNAS",CAAGUZU,5
7,501091,3212,ESC. BÁS. N° 1964 SAN JUAN BOSCO,1964,C. OVIEDO,"SAN JUAN BOSCO 
YUQUYTY",RURAL,0,1,90,E.E.B,1,0,REPARACIÓN INTEGRAL,CAAGUZU,5
6,501065,3186,ESC. BÁS. N° 1962 FERNANDO RUBÉN OVELAR JILEK,1962,C. OVIEDO,PLÁCIDO,RURAL,0,1,75,E.E.B,1,1,REPARCIÓN Y ADECUACIÓN DE INODORO,CAAGUZU,5
14,501061,3182,ESC. BÁS. Nº 801 DON ENRIQUE SOSA ,801,CNEL. OVIEDO ,CALLE SAN FRANCISCO ,RURAL,,R2,51,  E.E.B         1º Y 2º C. ,2,,REPARACIÓN AMBOS BAÑOS POR DETERIORO,CAAGUZU,5
1,501040,3161,ESC. BÁS. N° 2831 PANTALEÓN MONGES,2831,C. OVIEDO,CALLE HOVY,RURAL,0,1,140,E.E.B,3,0,REPARACIÓN DE PARED Y POZO CIEGO,CAAGUZU,5
8,506003,3572,ESC. BÁS. Nº 966 MCAL. FRANCISCO S. LÓPEZ,966,DR. JUAN M. FRUTOS,MBO´EHARA,URBANA,,7,563,E.E.B,6,,NECESITA REPARACIÓN POR MAL ESTADO.,CAAGUZU,5
54,506029,3598,ESC. BÁS. Nº 3157 SAN ENRIQUE DE OSSO,3157,DR. JUAN M. FRUTOS,1ª L. YTU,RURAL,,7,96,E.E.B,4,,EL SANITARIO ESTÁ MUY DETERIORADO.,CAAGUZU,5
55,506036,3605,ESC. BÁS. Nº 1825 ELVIO A. RODRÍGUEZ,1825,DR. JUAN M. FRUTOS,CALLE 7,RURAL,,7,147,E.E.B,1,,DEMORONAMIENTO COMPLETO POR SU TIEMPO DE UTILIDAD.,CAAGUZU,5
4,512001,3924,ESCUELA BASICA Nº 727 CRISTO REY,727,DR. E E ESTIGARRIBIA,SANTA LIBRADA,URBANA,,5,1334,E.E.B,4,, PARA ALBERGAR A MAS ALUMNOS Y EXISTE RAJADURAS EN LAS PAREDES ADEMÁS LA INSTITUCIÓN CUENTA MÁS DE 1300 ALUMNOS/AS,CAAGUZU,5
46,512017,3939,ESCUELA BASICA Nº 987 REINO DE HOLANDA,987,DR. E E ESTIGARRIBIA,MARACANA,RURAL,,5,190,E.E.B,3,,PRECARIA CONSTRUCCIÓN Y ATENTA CONTRA LA VIDA DE LOS ALUMNOS,CAAGUZU,5
48,512021,3943,ESCUELA BASICA Nº 3946,3946,DR. E E ESTIGARRIBIA,LA FORTUNA,URBANA,,5,450,E.E.B,3,,MALA CIMENTACIÓN QUE ATENTA CONTRA LA VIDA DE LOS ALUMNOS,CAAGUZU,5
51,515004,4083,ESCUELA BASICA Nº 1608,1608,J D OCAMPO,LA VIRGINIA,RURAL,,5,50,E.E.B,1,,MALA CIMENTACIÓN QUE ATENTA CONTRA LA VIDA DE LOS ALUMNOS,CAAGUZU,5
53,515001,4081,ESCUELA BASICA Nº 965,965,J D OCAMPO,J D OCAMPO,URBANA,,5,442,E.E.B,2,, POR MEJORAR LOS ASPECTOS ESTÉTICOS DE LA CONSTRUCCIÓN CUENTA CON  DETERIORO DE LA PINTURA Y EL PISO,CAAGUZU,5
47,512015,3937,ESCUELA BASICA Nº 2763,2763,DR. E E ESTIGARRIBIA,3 DE MAYO,RURAL,,5,150,E.E.B,2,,PRECARIA CONSTRUCCIÓN Y ATENTA CONTRA LA VIDA DE LOS ALUMNOS,CAAGUZU,5
52,515009,4088,ESCUELA BASICA Nº 1834,1834,J D OCAMPO,PASTOREO MI,RURAL,,5,30,E.E.B,1,,PRECARIA CONSTRUCCIÓN Y ATENTA CONTRA LA VIDA DE LOS ALUMNOS,CAAGUZU,5
24,508002,3700,ESC. BÁS Nº 140 LEON CADOGAN,140,NUEVA LONDRES,NUEVA LONDRES,URBANA, -,3,176,1º Y 2º CICLOS,6, - ,REPARACIÓN TOTAL POR DETERIORO DE CAÑERIAS,CAAGUZU,5
28,508008,3706,ESC. BÁS. Nº 5045 SAN RAFAEL,5045,NUEVA LONDRES,POTRERO TUYA,RURAL, -,3,75,1º Y 2º CICLOS,1, -,REPARACIÓN TOTAL POR DETERIORO,CAAGUZU,5
56,514023,4023,"ESC. BAS. N° 2770 ""S/N""",2770,RAÚL A. OVIEDO,BUENA VISTA,RURAL,,8,128,"1°,2° Y 3° CICLO",5,1,PLOMERIA,CAAGUZU,5
50,507057,3938,ESCUELA BASICA Nº 4258,4258,REPATRIACION,CULANTRILLO,RURAL,,5,296,E.E.B,3,,PRECARIA CONSTRUCCIÓN Y ATENTA CONTRA LA VIDA DE LOS ALUMNOS,CAAGUZU,5
19,507005,3628,"ESC. BÁS.Nº 4046 ""GRAL. NICOLAS DELGADO""",4046,REPATRIACIÓN,6A LÍNEA DELGADO,RURAL,NICOLÁS DELGADO,2ZB,119,E.E.B,6,,POR REPOSICIÓN,CAAGUZU,5
20,507043,3666,"ESC. BÁS. Nº 1734 ""VIRGEN DE LOS REMEDIOS""",1734,REPATRIACIÓN,1ª L. EUGENIO A. GARAY,RURAL,CALLE ITACURUBI,2ZB,145,E.E.B,2,,POR DETERIORO,CAAGUZU,5
23,507004,3627,"ESC. BÁS. Nº 3184 ""SAN FRANCISCO""",3184,REPATRIACIÓN,5ª LÍNEA SAN FRANCISCO,RURAL,SAN FRANCISCO,2ZB,35,E.E.B,1,,SÓLO CUENTA CON LETRINA,CAAGUZU,5
21,507015,3638,"ESC. BÁS. Nº 3180 "" SAN JOSÉ"" ",3180,REPATRIACIÓN,BRASILCUÉ ,RURAL,3 DE NOVIEMBRE,2ZB,107,E.E.B,3,,POR DETERIORO,CAAGUZU,5
22,507013,3636,"ESC. BÁS. Nº 4158 "" SAGRADA FAMILIA""",4158,REPATRIACIÓN,CHACORÉ 4ª LÍNEA,RURAL,CHACORÉ,2ZB,115,E.E.B,7,,"REPARACIÓN DE CAÑERIA, DESAGUE, INODOROS, ILUMINACIÓN",CAAGUZU,5
25,507034,3657,"ESC. BÁS. Nº 1842 ""MARIA AUXILIADORA""",1842,REPATRIACIÓN,CAAMINDY,RURAL,CAAMINDY,2ZB,211,E.E.B,7,,POR DETERIORO,CAAGUZU,5
18,507039,3662,"ESC. BÁS. Nº 3181 ""HOGAR DE LA CULTURA""",3181,REPATRIACIÓN,CAMPITO,RURAL,CAMPITO,2ZB,112,E.E.B,3,,POR REPOSICIÓN,CAAGUZU,5
20,513004,3977,"ESC.BÁS.Nº 953 ""SAGRADO CORAZÓN DE JESÚS""",953,R.I.3 CORRALES,CALLE 10,RURAL,,R2,104,E.I Y E.E.B,2,,"PRESENTA CAÑERÍA ROTA, INODORO Y CISTERNA DESCOMPUESTA Y DE LA PARTE ELÉCTRICA.",CAAGUZU,5
5,513009,3982,ESCUELA BÁSICA Nº 5055 SGTO. 1º ENRIQUE SCAVENIUS,5055,R. I. 3 CORRALES ,CALLE 22,RURAL,,2,130,E.E.B Y MEDIO,7,,FALTA DE REPARACIÓN DEL MOTOR Y ACCESORIOS EN GENERAL,CAAGUZU,5
21,513019,3992,"ESC.BÁS.Nº 1966 ""VIRGEN DE LOURDES""",1966,R.I.3 CORRALES,CALLE 10 TOBATIRY,RURAL,,R2,122,E.I Y E.E.B,2,,"PRESENTA CAÑERÍA ROTA, INODORO Y CISTERNA DESCOMPUESTA Y DE LA PARTE ELÉCTRICA.",CAAGUZU,5
26,509001,3707,"ESC. BÁS. Nº 291 ""MARÍA MERCEDES RAMOS DE VECBORT""",291,SAN JOAQUÍN,SAN JOAQUÍN,URBANA,,4,285,E.E.B,3,,FALTA DE REPARACIÓN GENERAL.,CAAGUZU,5
27,509030,3736,"ESCUELA BÁS. Nº 2149 ""DON JORGE ADALBERTO SOTO VARELA"" ",2149,SAN JOAQUÍN,TACUAPI'I,RURAL,,4,190,E.E.B,3,,FALTA DE REPARACIÓN GENERAL.,CAAGUZU,5
28,509043,15754,"ESC. BÁS. Nº 7435 ""ARSENIO VÁZQUEZ"" ",7435,SAN JOAQUÍN,-,RURAL,ARSENIO VÁZQUEZ,4,90,E.E.B,2,,FALTA DE REPARACIÓN GENERAL.,CAAGUZU,5
23,510007,3754,ESC. BÁS. Nº 912 PROF PEDRO CÁCERES,912,SAN JOSÉ DE LOS ARROYOS,CARIY CAÑADA,RURAL, -,3,170,"1º, 2º Y 3º CICLO",6, -,REPARACIÓN DE 6 CISTERNAS,CAAGUZU,5
22,510002,3749,ESCUELA BÁSICA Nº 243 PROF. ETELVINA SILVA DE ALVARENGA ,243,"SAN JOSÉ DE LOS 
ARROYOS",Bº VIRGEN DEL CARMEN,URBANA, -,3,197,"1º, 2º Y 3º CICLO",3, -,REPARACIÓN POR DETERIORO (SEXADO),CAAGUZU,5
25,510012,3759,ESC. BÁS. Nº 258 MAY. DE CAB. MIGUEL A. RAMOS ALFARO,258,SAN JOSÉ DE LOS ARROYOS,SERAFINI,RURAL, -,3,135,1º Y 2º CICLOS,4, -,REPARACIÓN POR DETERIORO (SEXADO),CAAGUZU,5
26,510011,3758,ESC. BÁS Nº 223 EDGAR RODOLFO STANLEY,223,SAN JOSÉ DE LOS ARROYOS,YHACA,RURAL,,3,123,1º Y 2º CICLOS,4,,REPARACIÓN TOTAL POR DETERIORO,CAAGUZU,5
33,519004,4168,"ESC.BÁS.Nº 3792 ""SANTA ANA""",3792,SIMÓN BOLÍVAR, CERRO SANTA ANA,RURAL,,9,140,1º Y 2º C.,2,,REPARACIÓN TOTAL POR DETERIORO ,CAAGUZU,5
74,520019,3834,"ESC. BÁS. Nº 3.118 ""VÍRGEN DE CAACUPE""",3118,VAQUERÍA,TECOYOYA 1ª L.,RURAL,,R10,180,E.E.B,6,,REPARACIÓN DE LOS ACCESORIOS,CAAGUZU,5
73,520017,3832,"ESC. BÁS. Nº 3.116 ""SANTO DOMINGO""",3116,VAQUERÍA,TECOYOYA ,RURAL,,R10,200,E.E.B,6,,REPARACIÓN DE LOS ACCESORIOS,CAAGUZU,5
71,520002,3808,"ESC. BÁS. Nº 1.599 ""DOÑA LEONOR MELGAREJO DE MEAURIO""",1599,VAQUERÍA,VAQUERÍA,URBANA,,R10,280,E.E.B,6,,"REPARACIÓN DE PLOMERÍA, WC, ELECTRIFICACIÓN ",CAAGUZU,5
75,520009,3816,"ESC. BÁS. Nº 3.756 ""VAQUERÍA""",3756,VAQUERÍA,VAQUERÍA,URBANA,,R10,200,E.E.B,2,,REPARACIÓN DE LOS ACCESORIOS,CAAGUZU,5
72,520012,3825,"ESC. BÁS. Nº 3.332 ""SAN PEDRO""",3332,VAQUERÍA,SAN PEDRO,RURAL,,R10,80,E.E.B,3,,"REPARACIÓN DE PLOMERÍA, WC, ELECTRIFICACIÓN ",CAAGUZU,5
62,511143,16029,"ESC. BÁS. Nº 7.540 ""MARÍA CRISTINA""",7540,YHÚ,MARÍA CRISTINA,RURAL,,R10,30,E.E.B,2,,"REPARACIÓN DE AZULEJO, CISTERNA, WATER, PUERTAS ",CAAGUZU,5
70,511136,11143,"ESC. BÁS. Nº 6.443 ""DR. PROF LUIS M. ARGAÑA""",6443,YHÚ,SAN MIGUEL Y FLORIDA ,RURAL,,R10,50,E.E.B,1,,"REPARACIÓN DE PLOMERÍA, WC, ELECTRIFICACIÓN ",CAAGUZU,5
60,511008,3796,"ESC. BÁS. Nº 3.576 "" VÍRGEN DE FÁTIMA""",3576,YHÚ,YATAITY,RURAL,,R10,60,E.E.B,_,2,,CAAGUZU,5
69,511010,3798,"ESC. BÁS. Nº 4.082 ""SAN ANTONIO""",4082,YHÚ,SAN ANTONIO,RURAL,,R10,165,E.E.B,2,,"REPARACIÓN DE PLOMERÍA, WC, ELECTRIFICACIÓN ",CAAGUZU,5
61,511009,3797,"ESC.BÁS. Nº 3.330 ""SAN MIGUEL ARCÁNGEL""",3330,YHÚ,YHÚ,URBANA,,R10,100,E.E.B,3,,"REPARACIÓN DE PLOMERÍA, WC, ELECTRIFICACIÓN Y LAVATORIO",CAAGUZU,5
63,511031,3819,"ESC. BÁS. Nº 1.600 ""NMACULADO C. DE MARÍA""",1600,YHÚ,CAÑADITA,RURAL,,R10,60,E.E.B,1,,"REPARACIÓN DE AZULEJO, CISTERNA, WATER, PUERTAS ",CAAGUZU,5
66,511052,3840,"ESC. BÁS. Nº 3.123 ""SAN FRANCISCO DE ASÍS""",3123,YHÚ,DEPÓSITO CUÉ,RURAL,,R10,100,E.E.B,1,,REPARACIÓN DE PLOMERIA,CAAGUZU,5
64,511033,3821,"ESC. BÁS. Nº 3.114 ""SAN LORENZO""",3114,YHÚ,TARUMA,RURAL,,R10,50,E.E.B,1,,"REPARACIÓN DE AZULEJO, CISTERNA, WATER, PUERTAS ",CAAGUZU,5
65,511051,3839,"ESC. BÁS. Nº 3.122 ""VÍRGEN DEL ROSARIO""",3122,YHÚ,MARACANÁ,RURAL,,R10,101,E.E.B,3,,"POR RAJADURAS DE PAREDES, TECHOS Y PISOS",CAAGUZU,5
67,511079,3867,"ESC. BÁS. Nº 3127  ""SAN JORGE""",3127,YHÚ,MCAL. LÓPEZ ,RURAL,,R10,70,E.E.B,1,,YA TIENE GRIETA EN EL TECHO,CAAGUZU,5
10,610029,4598,ESC. BÁS. N° 964 AUGUSTO R. BASTOS ,964,YUTY,YATAITY,RURAL,AS. YATAITY,1,182,E.I E.E.B,4,4,ACCESORIOS DETERIORADOS ,CAAZAPA,6
11,610037,4606,ESC. BÁS. N° 1630 MA. AUXILIADORA,1630,YUTY,CAPIITINDY,RURAL,,1,157,E.I E.E.B,6,0,ACCESORIOS DETERIORADOS ,CAAZAPA,6
1,601001,4179,ESC. BÁS. N° 915 ZOILO VERA,915,CAAZAPÁ,V. ROSARIO,URBANA,,3,130,E.I E.E.B,3,2,ESTADO DETERIORADO ,CAAZAPA,6
9,601052,4230,ESC. BÁS. N° 2492 SDA FAMILIA,2492,YUTY,CERRITO,RURAL,AS. CERRITO,1,183,E.I E.E.B,3,3,ACCESORIOS DETERIORADOS ,CAAZAPA,6
4,609011,4565,ESC. BÁS. N° 309 SAN JOSÉ,309,YEGROS ,ISLA SACA,RURAL,,1,120,E.I E.E.B,1,0,CAÑERIA Y REVESTIDOS ESTÁN EN DETERIOROS ,CAAZAPA,6
6,609010,4564,ESC. BÁS. N° 541 CNEL DOMINGO GAONA,541,YEGROS,PIRAPO,RURAL,,1,102,E.I E.E.B,2,0,ARREGLO DE CAÑERÍAS,CAAZAPA,6
2,606009,4391,ESC. BÁS. N° 4372 FABRICIANA RIOS,4372,MACIEL,PARAGUA P. ,RURAL,,3,65,E.I E.E.B,1,1,NECESITA REPARACIÓN DE TECHOS Y PAREDES,CAAZAPA,6
8,610012,4581,ESC. BÁS. N° 2495 HERIBERTA M. DE ARMOA,2495,YUTY,SAN ISIDRO ,RURAL,,1,230,E.I E.E.B,5,0,ARREGLO DE PLOMERÍA Y CONSTRUCCIÓN DE CAÑERÍAS,CAAZAPA,6
7,610002,4571,ESC. BÁS. N° 63 DR. PEDRO ZARZA R,63,YUTY,SAN LUIS,URBANA,,1,34,E.I E.E.B,1,0,SEGURIDAD Y SALUBRIDAD ARREGLO DE CAÑERÍAS,CAAZAPA,6
3,1403002,9411,ESC. BAS. N° 3017 34 CURUGUATEÑOS,3017,CURUGUATY,SANTA MARÍA,URBANA,SANTA MARÍA,2,1100,E.E.B.,6,,DETERIORO DE CAÑERÍAS Y ACCESORIOS,CANINDEYU,14
4,1403084,9493,ESC. BAS. N° 3016 GRAL DE EJÉRCITO DON A. RODRÍGUEZ,3016,CURUGUATY,7 MONTES,RURAL,7 MONTES,2,132,E.E.B.,5,,DETERIORO DE CAÑERÍAS Y ACCESORIOS,CANINDEYU,14
1,1407029,9697,ESC.BÁS. N° 3544 SAN JUAN BAUTISTAS,3544,FCO. CAB. ALV.,SAN JUAN,RURAL,SAN JUAN,1,,E.E.B,4,2,ESTA EN DETERIORO Y NO CUENTA CON AGUA.,CANINDEYU,14
9,1401035,9319,ESC. BÁS. N° 6973 SAN JORGE,6973,SALTOS DEL GUAIRA,SAN JOSGE,RURAL,,9,,E.E.B.,5,,POR CUMPLIR SU CICLO DE USO,CANINDEYU,14
12,1410039,9676,ESCUELA BÁSICA Nº 4306 SAN JOSÉ OBRERO,4306,NVA. ESPERANZA,NVA. ESPERANZA,URBANA,,8,,E.E.B.,8,,POR MAL ESTADO,CANINDEYU,14
13,1410026,9716,ESCUELA BÁSICA Nº 4311 SANTA LUCIA,4311,NVA. ESPERANZA,COL. TRACTOR CUE,RURAL,,8,,E.E.B.,4,,POR MAL ESTADO,CANINDEYU,14
8,1401017,9301,ESC. BÁS. N° 2521 JOSÉ A. FLORES,2521,SALTOS DEL GUAIRA,COL. CANINDEYÚ,RURAL,,9,,E.E.B.,6,,POR CUMPLIR SU CICLO DE USO,CANINDEYU,14
7,1401003,9287,ESC. BÁS. N° 4280 ITAIPÚ,4280,SALTOS DEL GUAIRA,ITAIPÚ,URBANA,,9,,E.E.B.,2,,POR CUMPLIR SU CICLO DE USO,CANINDEYU,14
6,1401006,9290,ESCSELA BÁS. N° 411 CARLOS RICARDO MENDES GONCALVEZ,411,SALTOS DEL GUAIRA,SANTA ROSA,URBANA,,9,,E.E.B.,10,,POR CUMPLIR SU CICLO DE USO,CANINDEYU,14
10,1401002,9286,ESC. BÁS. N° 4281 DR.  DIONISIO GONZÁLEZ TORRES,4281,SALTOS DEL GUAIRA,SAN PEDRO,URBANA,,9,,E.E.B. -         N. M - E. P,10,,POR CUMPLIR SU CICLO DE USO,CANINDEYU,14
111,1101037,7548,ESC. BÁS. N° 4818 TAJY POTY ,4818,AREGUÁ,CAACUPEMI,URBANA,ASENT. TAJY POTY,R3,147,"EDUC. INICIAL,1°, 2°,3° CICLO E.E.B",6,-,"YA VENCIERON SU VIDA ÚTIL, DETERIORADOS",CENTRAL,11
120,1101036,7547,ESC. BÁS. N° 5627 AMANECER ,5627,AREGUÁ,CAACUPEMI,URBANA,,R3,50,3° CICLO E.E.B,3,-,"LOS SANITARIOS YA PERDIERON SU VIDA UTIL, HAY PERDIDA DE AGUA",CENTRAL,11
26,1101002,7513,ESC. BÁS. N° 86 DOMINGO MARTÍNEZ DE IRALA ,86,AREGUÁ,SANTO DOMINGO,URBANA,,R3,400,2° CICLO E.E.B,7,,"ESTAN MUY DETERIORADOS Y EN MAL ESTADO LAS CAÑERIAS , GRIFERIAS DEBIDO A LA CANTIDAD DE USUARIOS, URGE LA REPARACIÓN COMPLETA Y RENOVACION DE LOS ACCESORIOS",CENTRAL,11
143,1101004,7515,ESC. BÁS. N° 5626 BENIGNO GABRIEL CASACCIA BIBOLINI,5626,AREGUÁ,SAN MIGUEL,URBANA,,R3,362,"EDUC. INICIAL,1°, 2°,3° CICLO E.E.B",12,2,SE ENCUENTRAN DETERIORADO POR SU ANTIGÜEDAD,CENTRAL,11
202,1101004,7515,ESC. BÁS. N° 5626 BENIGNO GABRIEL CASACCIA BIBOLINI,5626,AREGUÁ,SAN MIGUEL,URBANA,,R3,362,"EDUC. INICIAL,1°, 2°,3° CICLO E.E.B",12,2,SE ENCUENTRAN DETERIORADO POR SU ANTIGÜEDAD,CENTRAL,11
58,1101003,7514,ESC. BÁS. N° 346 DR. WALTER ENRIQUE INSFRÁN ,346,AREGUÁ,LAS MERCEDES,URBANA,,R3,67,NIVEL INICIAL,4,4,ADECUAR AL NIVEL Y NECESIDADES REPARACION DE CAÑERIAS,CENTRAL,11
17,1102139,13190,ESC. BÁS. N° 6955 OSCAR AGUILERA,6955,CAPIATA,KM. 19 RUTA 1 Bº 8 DE DICIEMBRE,URBANA,8 DE DICIEMBRE,R8,236,N1,2,1,EL SANITARIO ES PRECARIO Y ES URGENTE LA REPARACIÓN,CENTRAL,11
116,1102141,13192,ESC. BÁS. N° 6954 SAN CAYETANO,6954,CAPIATA,KM. 23 RUTA 1 CÑIA. 7 YBYRARO,URBANA,SAN CAYETANO,R8,350,N1,2,2,"SE REQUIERE REPARACIÓN EN CUANTO A CAÑERÍAS ROTAS, ANTE LA EXCESIVA CANTIDAD DE NIÑOS DEL NIVEL INICIAL QUE COMPARTEN CON EL 2º Y 3º CICLO LOS MISMOS SANITARIOS",CENTRAL,11
77,1102002,7567,ESC. BÁS. N° 2856 SAN ROQUE,2856,CAPIATA,KM. 19 RUTA 1 Bº EL RETIRO,URBANA,,R8,840,N1,2,,INFRAESTRUCTURA MUY VIEJA Y DETERIORADA,CENTRAL,11
98,1102011,7576,ESC. BÁS. N° 2398 VIRGEN DEL PILAR,2398,CAPIATA,KM. 18 RUTA 1 VIRGEN DEL PILAR,URBANA,,R8,580,N1,8,10,"LAS CANILLAS Y SIATERNAS PIERDEN CONSTANTEMENTE AGUA, LAS PUERTAS ALGUNAS ESTÁN ROTAS Y NO TIENEN CERROJO, EL TANQUE DE AGUA GOTEA NECESITA URGENTE MANTENIMIENTO Y REPARACIÓN DE LA BASE QUE LO SOSTIENE, EN ESTAS CONDICIONES PONE EN PELIGRO LA VIDA DE TODO",CENTRAL,11
44,1102004,7569,ESC. BÁS. N° 330 AGUSTÍN PÍO BARRIOS,330,VILLA ELISA,PICADA,URBANA,VILLA CONAVI II,R3,260,E.E.B.,2,-----------,"SE NECESITA LA REPARACIÓN EN LA PARTE ELECTRICA, PLOMERIA Y ALGUNOS LAVATORIOS Y AZULEJOS QUE DEBEN SER CAMBIADOS.",CENTRAL,11
24,1102019,7584,ESC. BÁS. N° 3344 CONSTITUCIÓN,3344,CAPIATA,VILLA CONSTITUCION,URBANA,R3,--------------------------,452,COMPARTIDO,2,-,REPARACION DE PLOMERIA EN GENERAL,CENTRAL,11
29,1102019,7584,ESC. BÁS. N° 3344 CONSTITUCIÓN,3344,CAPIATA,VILLA CONSTITUCION,URBANA,,R3,452,COMPARTIDO,2,,REPARACION DE PLOMERIA EN GENERAL,CENTRAL,11
49,1102029,7594,ESC. BÁS. N° 2857 CLUB DE LEONES,2857,CAPIATA,CAPIATA,URBANA,R3,--------------------------,250,COMPARTIDO,2,,"POZO CIEGO LLENO,PLOMERIA,DETERIORO",CENTRAL,11
119,1102029,7594,ESC. BÁS. N° 2857 CLUB DE LEONES,2857,CAPIATA,CAPIATA,URBANA,,R3,250,COMPARTIDO,2,,"POZO CIEGO LLENO,PLOMERIA,DETERIORO",CENTRAL,11
160,1102033,7598,ESC. BÁS. N° 88    ENRIQUE SOLER,88,CAPIATA,CAPIATA,URBANA,,R3,181,"INICIAL , 1° CICLO",1,,REPARACION TOTAL,CENTRAL,11
71,1102094,7682,ESC. BÁS. N° 15390 SANTO DOMINGO,15390,CAPIATA,CAPIATA,URBANA,,R3,240,E.E.B,2,,PLOMERIA Y TECHO,CENTRAL,11
5,1102041,7606,ESC. BÁS. N° 81 MARIA AUXILIADORA,81,CAPIATA,KM. 23 RUTA 1 CÑIA. 7 YBYRARO,URBANA,,R8,982,N1,2,1,DETERIORO DE LA CONSTRUCCIÓN,CENTRAL,11
158,1102051,7616,ESC. BÁS. N° 319 VIRGEN DEL ROSARIO,319,CAPIATA,ALDANA CAÑADA,URBANA,,R3,584,1° Y 2° CICLO,6,,REPARACION TOTAL,CENTRAL,11
58,1102048,7613,ESC. BÁS. N° 3731  SAGRADO CORAZON DE JESUS,3731,CAPIATA,PIRO'Y,URBANA,R3,--------------------------,789,COMPARTIDO,3,,REPARACION TOTAL,CENTRAL,11
136,1102048,7613,ESC. BÁS. N° 3731  SAGRADO CORAZON DE JESUS,3731,CAPIATA,PIRO'Y,URBANA,,R3,789,COMPARTIDO,3,,REPARACION TOTAL,CENTRAL,11
65,1102003,7568,ESC. BÁS. N° 2396 SR. ANGEL RIQUELME,2396,CAPIATA,KM. 20 RUTA 1 CÑIA. 5ª YATAITY,URBANA,,R8,300,N1,8,6,"EL BAÑO SEXADO DISPONIBLE NECESITA REPARACIÓN, EN ESPECIAL, LAS CAÑERÍAS ESTÁN EN MAL ESTADO, DESPIDE UN OLOR FUERTE QUE DIFICULTA EL NORMAL DESARROLLO DE LAS CLASES EN LAS AULAS CERCANAS, ADEMÁS FALTA MANTENIMIENTO DEL POZO CIEGO. EN LA INSTITUCIÓN NO SE",CENTRAL,11
46,1102129,12132,ESC. BÁS. N° 6867  MUNICIPAL SAN WENCESLAO,6867,CAPIATA,NARANJATY,URBANA,R3,--------------------------,300,COMPARTIDO,2,2,_,CENTRAL,11
110,1102129,12132,ESC. BÁS. N° 6867  MUNICIPAL SAN WENCESLAO,6867,CAPIATA,NARANJATY,URBANA,,R3,300,COMPARTIDO,2,2,_,CENTRAL,11
45,1102118,740,ESC. BÁS. N° 6684 NUEVA ESPERANZA,6684,CAPIATA,KM. 23 RUTA 1 CÑIA. 7 YBYRARO,URBANA,,R8,150,N1,2,-,MAL ESTADO Y ES INADECUADO PARA EL USO DE LOS EDUCANDOS,CENTRAL,11
86,1102050,7615,ESC. BÁSC. N° 822 LUÍS FUSTAGNO,822,CAPIATA,TOLEDO CAÑADA,URBANA,R3,_,369,COMPARTIDO,5,,SANITARIOS Y PLOMERIA,CENTRAL,11
86,1102050,7615,ESC. BÁSC. N° 822 LUÍS FUSTAGNO,822,CAPIATA,TOLEDO CAÑADA,URBANA,,R3,369,COMPARTIDO,5,,SANITARIOS Y PLOMERIA,CENTRAL,11
28,1103060,7750,ESC. BÁS. N° 2001 DON BOSCO,2001,FERNANDO DE LA MORA,LAGUNA GRANDE,URBANA,,R1,198,N1,,,"EL PEDIDO OBEDECE A QUE LOS SANITARIOS DE LOS ALUMNOS/AS SE ENCUENTRAN MUY DETERIORADOS, NO CUENTAN CON DIVISORIAS, LAS PAREDES ESTÀN AGRIETADAS, EL PISO SE ENCUENTRA HUNDIDO, ENTRE OTRAS NECESIDADES.",CENTRAL,11
56,1103034,7724,ESC. BÁS. N° 662 REPSA 1,662,FERNANDO DE LA MORA,LAS RESIDENTAS,URBANA,,R1,500,N1,5,-,"POR LA FALTA DE RUBRO PARA REALIZAR EL MANTENIMIENTO DE LOS SANITARIOS, Y POR LOS AÑOS DE UTILIZACION DEL MISMO, SE NECESITA DE UN BUEN MANTENIMIENTO",CENTRAL,11
40,1103022,7712,ESC. BÁS. N° 388 GENERAL BERNARDINO CABALLERO,388,FERNANDO DE LA MORA,BERNARDINO CABALLERO,URBANA,,R1,,N1,7,8,POR LA NECESIDAD DE BAÑOS ADECUADOS Y SALUBRES,CENTRAL,11
16,1103006,7696,ESC. BÁS. N° 824 REVERENDO PADRE LUCIANO CESTAC,824,FERNANDO DE LA MORA,SAN JUAN,URBANA,,R1,1200,N1,11,,"LAS INSTALACIONES SANITARIAS USAN DE MANERA COMPARTIDA CON EL COLEGIO, QUE USUFRUCTA EL MISMO PREDIO QUE LA INSTITUCIÒN, Y POR ELLO EL DETERIORO DE LOS MISMOS SE HACE CONSTANTE.",CENTRAL,11
48,1103012,7702,ESC. BÁS. N° 3652 SAN JOSÉ OBRERO,3652,FERNANDO DE LA MORA,TRES BOCAS,URBANA,,R1,400,N1,9,,"DETERIORO DE LA PARTE DE PLOMERIA, CONEXIONES.",CENTRAL,11
4,1103018,7708,ESC. BÁS. N° 959 PROF. MERCEDES IBARRA,959,FERNANDO DE LA MORA,TRES BOCAS,URBANA,,R1,650,N1,20,,EL ESTADO DE LOS SANITARIOS SE ENCUENTRAN EN MUY MALAS CONDICIONES.,CENTRAL,11
73,1104023,13184,ESC. BÁS. Nº 6938 VIRGEN DEL CARMEN,6938,GUARAMBARÉ,KURUSU LEGUA,URBANA,,1,450,E.E.B,8,,"REPARACIÓN DE 4 CISTERNAS, INODOROS, 2 LAVATORIOS, 2 PUERTAS DE BAÑO, CANALETAS, CAÑERÍAS, REPARACIÓN DE POZO CIEGO URGENTE.",CENTRAL,11
3,1104004,7822,ESC. BÁS. Nº 91  MEDALLA MILAGROSA,91,GUARAMBARÉ,Bº ALEGRE,URBANA,,1,800,N1,10,5,INSTALACIONES SANITARIAS DETERIORADAS,CENTRAL,11
59,1104009,7827,ESC. BÁS. Nº 6876 GUARAMBARÉ,6876,GUARAMBARÉ,Bº ALEGRE,URBANA,,1,250,E.E.B,5,,PARA MEJORAR INSTALACIÓN,CENTRAL,11
31,1104017,11222,ESC. BÁS. Nº 6237 TESAPE ARA,6237,GUARAMBARÉ,Bº ALEGRE,URBANA,,1,375,COMPARTIDO,3,,POR LA SALUBRIDAD DE LA INSTITUCIÓN,CENTRAL,11
57,1105009,7844,"E.E.B 302 ESC. BÁS, Nº 302 JUAN E. O´LEARY",302,ITÁ,ENRIQUE DOLDÁN IBIETA E/MCAL. LÓPEZ Y SAN BLAS,URBANA,BO SAN ANTONIO,R5,990,N1,8,,REPARACION URGENTE DE PLOMERIA GRIFERIA POR EL DETERIORO DE MUCHOS AÑOS DE USO,CENTRAL,11
28,1105008,7843,E.E.B 981 ESC. BÁS. Nº 981 PROF. MODESTO VILLALBA GUTIÉRREZ,981,ITÁ,RUTA GRAL. SAMANIEGO,RURAL,R5,CAAGUAZÚ,100,N2,6,,"DOS BAÑOS VIEJOS Y UNO CONSTRUIDO POR LA GOBERNACION QUE REQUIERE REPARARSE, FALTA TERMINACION DE 2 BAÑOS EN OFICINAS ADMINISTRATIVAS",CENTRAL,11
95,1105065,12158,E.E.B 6423 ESC. BÁS. Nº 6423 MARÍA AUXILIADORA,6423,ITÁ,RUTA Nº1.MCAL. LÓPEZ. KM.32,RURAL,POSTA GAONA,R5,120,E.E.B,2,1,PARA UNA MEJOR HIGIENE Y COMODIDAD,CENTRAL,11
148,1105061,11550,E.E.B 6405 ESC. BÁS. Nº 6405 SAN FRANCISCO DE ASÍS,6405,ITÁ,"RUTA Nº1.MCAL. LÓPEZ. KM.42,5",RURAL,ITÁ POTRERO,R5,152,E.E.B,8,,SE ENCUENTRAN CON PROBLEMAS EN LAS CAÑERIAS ,CENTRAL,11
113,1105004,7839,E.E.B 706 ESC. BÁS. Nº 706 DON ANTONIO J. DELVALLE,706,ITÁ,TTE. VALDOVINOS C/ GRAL. DÍAZ,URBANA,BO. SAN BLAS,R5,450,E.E.B,6,,"EL POZO CIEGO, LOS INODOROS CISTERNAS PISOS, Y PAREDES NECESITAN SER CAMBIADOS Y REPARADOS POR LOS AÑOS DE USO QUE TIENEN",CENTRAL,11
92,1105045,7886,E.E.B 5624 ESC. BÁS. Nº 5624 DIVINO JESÚS,5624,ITÁ,MBURUCUYÁ E/YBAHÁI. VILLA MA. AUXILIADORA,RURAL,CAAGUAZÚ,R5,350,N1,4,1,SE NECESITA ABIR EL BAÑO DE EDUCACION INICIALHACIA ADENTRO PARA QUE LOS NIÑOS/AS NO SALGAN DEL AULA. LOS DEMAS SANITARIOS NECESITAN REPARACIONES VARIAS ,CENTRAL,11
8,1106029,7928,ESC. BÁS. N° 2129 VIRGEN MEDALLA MILAGROSA,2129,ITAUGUA,CÑIA. JHUGUA POTI,URBANA,R4,--------------------------,51,COMPARTIDO,5,,"REPARACIÓN DE PLOMERÍA, INSTALACIÓN ELÉCTRICA",CENTRAL,11
9,1106029,7928,ESC. BÁS. N° 2129 VIRGEN MEDALLA MILAGROSA,2129,ITAUGUA,CÑIA. JHUGUA POTI,URBANA,,R4,51,COMPARTIDO,5,,"REPARACIÓN DE PLOMERÍA, INSTALACIÓN ELÉCTRICA",CENTRAL,11
82,1106009,7908,ESC. BÁS. N° 3283 JARDIN DE ITAUGUA,3283,ITAUGUA,CÑIA. CAÑADITA,URBANA,R4,--------------------------,30,E.M.,3,2,"RAJADURAS EN LAS PAREDES, TECHO, PINTURA INTERIOR Y EXTERIOR, ABERTURAS, INSTALACION ELECTRICA",CENTRAL,11
